Norma;Descricao da Sigla;Data de Apresentacao;Autor;Partido;Ementa;Link Documento PDF;Link Página Web;Indexacao;Último Estado;Data Último Estado;Situação;Score Final;Boost Keyword;Similaridade Semantica
PL 3821/2024;Projeto de Lei;2024-10-07;Amanda Gentil;PP;Altera o Decreto-Lei nº 2.848, de 7 de dezembro de 1940 (Código Penal), e a Lei nº 9.504, de 30 de setembro de 1997 (Lei das Eleições), para tipificar o crime de manipulação digital de imagens por inteligência artificial, e agravar a pena em casos de crimes contra mulheres e candidaturas em período eleitoral, e dá outras providências.;https://www.camara.leg.br/proposicoesWeb/prop_mostrarintegra?codteor=2482757;https://www.camara.leg.br/proposicoesWeb/fichadetramitacao?idProposicao=2461213;Alteração, Código Penal (1940), Lei das Eleições (1997), exposição de intimidade sexual, tipificação penal, tratamento de imagem, inteligência artificial, pornografia falsa (porno fake), deep nude, intimidação, retaliação, constrangimento, aumento da pena, vítima, mulher, publicação, rede social, Plataforma digital, Ação penal pública incondicionada, proibição, inteligência artificial, Conteúdo sexual, Candidato a cargo eletivo, aumento da pena, vítima, candidata, mulher, crime eleitoral.;Expedição de Documento;2025-02-26;Aguardando Apreciação pelo Senado Federal;0.6209;SIM;0.4584
PL 2061/2021;Projeto de Lei;2021-06-08;José Guimarães;PT;Regulamenta a profissão de Motorista Autônomo por Aplicativos e dá outras providências.;https://www.camara.leg.br/proposicoesWeb/prop_mostrarintegra?codteor=2023887;https://www.camara.leg.br/proposicoesWeb/fichadetramitacao?idProposicao=2285905;Regulamentação profissional, motorista autônomo, motorista de aplicativo, transporte remunerado, particular, passageiro, Atividade profissional, atribuição, jornada de trabalho, categoria profissional.;Notificacao para Publicação Intermediária;2025-05-30;Tramitando em Conjunto;0.6198;SIM;0.4569
PL 1310/2025;Projeto de Lei;2025-03-28;Bruno Ganem;PODE;Altera a Lei nº 13.756, de 12 de dezembro de 2018, que dispõe sobre o Fundo Nacional de Segurança Pública (FNSP) e outras matérias, a fim de condicionar o recebimento de seus recursos à implementação de tecnologias de inteligência artificial nas ouvidorias e corregedorias dos órgãos de segurança pública, nos termos que especifica.;https://www.camara.leg.br/proposicoesWeb/prop_mostrarintegra?codteor=2875075;https://www.camara.leg.br/proposicoesWeb/fichadetramitacao?idProposicao=2490966;Alteração, Legislação, Fundo Nacional de Segurança Pública (FNSP), destinação, Recursos financeiros, Investimento público, Inteligência artificial, modernização, Ouvidoria pública, Órgão de segurança pública.;Saída de Relator(a) da Comissão - Sem Parecer Apresentado;2026-02-03;Aguardando Designação - Aguardando Devolução de Relator(a) que deixou de ser Membro;0.6196;SIM;0.4565
PL 5548/2025;Projeto de Lei;2025-10-30;Wellington Roberto;PL;Altera a Lei nº 13.709, de 14 de agosto de 2018 (Lei Geral de Dados Pessoais – LGPD), disciplinando o tratamento de dados preditivos de saúde por sistemas de inteligência artificial e congêneres.;https://www.camara.leg.br/proposicoesWeb/prop_mostrarintegra?codteor=3035106;https://www.camara.leg.br/proposicoesWeb/fichadetramitacao?idProposicao=2579218;Alteração, Lei Geral de Proteção de Dados Pessoais (LGPDP) (2018), Tratamento de dados, Dados pessoais sensíveis, Prontuário médico, Inteligência artificial, Algoritmo, cálculo, Probabilidade e Estatística, Doença, fator de risco, Operadora de plano de assistência à saúde, Instituição financeira, Empregador.;Encerramento de Prazo;2026-02-11;Aguardando Parecer;0.6190;SIM;0.4557
PL 3762/2019;Projeto de Lei;2019-06-27;André Figueiredo;PDT;Regulamenta a profissão de Biotecnologista.;https://www.camara.leg.br/proposicoesWeb/prop_mostrarintegra?codteor=1770417;https://www.camara.leg.br/proposicoesWeb/fichadetramitacao?idProposicao=2209732;Regulamentação profissional, Biotecnologista.;Saída de Relator(a) da Comissão - Com Parecer Apresentado;2026-02-10;Aguardando Designação de Relator(a);0.6183;SIM;0.4547
PL 537/2024;Projeto de Lei;2024-03-04;Rodrigo Gambale;PODE;Dispõe sobre o fortalecimento da atividade de inteligência policial para a prevenção, investigação e repressão aos crimes cujo aliciamento de pessoas ocorre pela Internet e as ações de violência extrema e mórbida se manifestam fora dela.;https://www.camara.leg.br/proposicoesWeb/prop_mostrarintegra?codteor=2391187;https://www.camara.leg.br/proposicoesWeb/fichadetramitacao?idProposicao=2419152;Alteração, Lei Federal, fortalecimento, inteligência policial, prevenção, investigação, repressão, crime, aliciamento, internet, atuação, violência extrema. _Investigação, prevenção, repressão, crime cibernético, repercussão social, violência. _Critério, aplicação, recursos, Fundo Nacional de Segurança Pública (FNSP), inclusão, meta, resultado, relação, prevenção, investigação, repressão, crime cibernético. _Alteração, Lei Federal, recursos, Fundo Nacional de Segurança Pública (FNSP), destinação, atuação, inteligência policial, prevenção, investigação, repressão, crime cibernético, repercussão social, violência.;Parecer do(a) Relator(a);2025-06-23;Pronta para Pauta;0.6145;SIM;0.4492
PL 1434/2025;Projeto de Lei;2025-04-02;Paulo Alexandre Barbosa;PSDB;Trata-se de projeto de lei que tem por objetivo dispor  sobre o exercício da atividade de Analista do Comportamento e Técnico em Análise do Comportamento.;https://www.camara.leg.br/proposicoesWeb/prop_mostrarintegra?codteor=2879487;https://www.camara.leg.br/proposicoesWeb/fichadetramitacao?idProposicao=2494112;Regulamentação profissional, analista, técnico, Análise do Comportamento Aplicada (ABA), pessoa neuroatípica, transtorno comportamental, Transtorno do Espectro Autista (TEA), saúde, educação, estudo, envelhecimento, diretrizes, graduação.;Apresentação de Requerimento;2025-06-02;Aguardando Designação de Relator(a);0.6142;SIM;0.4488
PL 19/2026;Projeto de Lei;2026-02-02;Carlos Zarattini;PT;Estabelece condições, deveres e restrições ao uso de óculos inteligentes com recursos de inteligência artificial, altera a Lei nº 9.503, de 23 de setembro de 1997 (Código de Trânsito Brasileiro) e o Decreto-Lei nº 2.848, de 7 de dezembro de 1940 (Código Penal), e dá outras providências.;https://www.camara.leg.br/proposicoesWeb/prop_mostrarintegra?codteor=3075824;https://www.camara.leg.br/proposicoesWeb/fichadetramitacao?idProposicao=2600015;Regulamentação, utilização, óculos, inteligência artificial, proteção, dados pessoais, direito à privacidade, segurança pública, responsabilidade civil, fiscalização, diretrizes. _Alteração, Código de Trânsito Brasileiro (1997), descumprimento, infração de trânsito, Código Penal (1940), tipificação de conduta, pena.;Apresentação de Proposição;2026-02-02;;0.6137;SIM;0.4481
PL 2676/2025;Projeto de Lei;2025-06-02;Jandira Feghali;PCdoB;Regula o exercício da profissão de agente artístico.;https://www.camara.leg.br/proposicoesWeb/prop_mostrarintegra?codteor=2924491;https://www.camara.leg.br/proposicoesWeb/fichadetramitacao?idProposicao=2519919;Regulamentação profissional, agente artístico, diretrizes, setor cultural.;Abertura de Prazo;2025-12-22;Aguardando Parecer;0.6131;SIM;0.4473
PL 1477/2023;Projeto de Lei;2023-03-28;Alberto Fraga;PL;Institui, no âmbito do Sistema Brasileiro de Inteligência (SISBIN), o Subsistema de Monitoramento e Alerta Contra Atos Extremistas Violentos, e dá outras providências.;https://www.camara.leg.br/proposicoesWeb/prop_mostrarintegra?codteor=2251339;https://www.camara.leg.br/proposicoesWeb/fichadetramitacao?idProposicao=2353932;Criação, Subsistema de Monitoramento e Alerta Contra Atos Extremistas Violentos, âmbito, Sistema Brasileiro de Inteligência (SISBIN), integração, órgão público, prevenção, enfrentamento, ataque violento, diretrizes.;Saída de Relator(a) da Comissão - Sem Parecer Apresentado;2025-03-19;Aguardando Designação - Aguardando Devolução de Relator(a) que deixou de ser Membro;0.6103;SIM;0.4432
PL 4276/2025;Projeto de Lei;2025-08-27;Pedro Paulo;PSD;Altera a Lei nº 9.613, de 3 de março de 1998, para regulamentar a produção e o compartilhamento do Relatório de Inteligência Financeira (RIF) produzido no âmbito do Conselho de Controle de Atividades Financeiras (COAF).;https://www.camara.leg.br/proposicoesWeb/prop_mostrarintegra?codteor=2987529;https://www.camara.leg.br/proposicoesWeb/fichadetramitacao?idProposicao=2554195;Alteração, Lei de Lavagem de Dinheiro (1998), criação, Relatório de Inteligência Financeira (RIF), Conselho de Controle de Atividades Financeiras (COAF), comunicação, crime, autoridade, diretrizes.;Encerramento de Prazo;2025-11-03;Aguardando Parecer;0.6096;SIM;0.4423
PL 3385/2019;Projeto de Lei;2019-06-06;José Medeiros;PL;Dispõe sobre o impedimento de divulgação em fontes abertas de informações de policiais e agentes de inteligência.;https://www.camara.leg.br/proposicoesWeb/prop_mostrarintegra?codteor=1761386;https://www.camara.leg.br/proposicoesWeb/fichadetramitacao?idProposicao=2207044;Impedimento, divulgação, dados pessoais, agente de polícia, agente de inteligência, classificação, informação, sigilosa.;Notificações;2024-12-17;Tramitando em Conjunto;0.6092;SIM;0.4417
PL 4323/2025;Projeto de Lei;2025-08-29;Delegado Bruno Lima;PP;Altera a Lei nº 8.069, de 13 de julho de 1990 (Estatuto da Criança e do Adolescente), para tipificar o crime de aliciamento cibernético em tempo real e agravar penas para a utilização de inteligência artificial na produção de material de exploração sexual infantil.;https://www.camara.leg.br/proposicoesWeb/prop_mostrarintegra?codteor=2988838;https://www.camara.leg.br/proposicoesWeb/fichadetramitacao?idProposicao=2554834;Alteração, Estatuto da Criança e do Adolescente (ECA) (1990), tipificação de conduta, Aliciamento de menores, produção, conteúdo sexual, Ambiente virtual, exploração sexual, Inteligência artificial, Deepfake, enfrentamento, pornografia infantil, Adultização de crianças e adolescentes.;Apresentação de Requerimento;2025-10-02;Aguardando análise do Presidente da Câmara - (Decisão);0.6089;SIM;0.4412
PL 1243/2025;Projeto de Lei;2025-03-26;Jonas Donizette;PSB;Altera as Leis n° 9.279, de 1996, e 9.610, de 1998, de modo a permitir o registro de pseudônimo ou apelido notoriamente conhecidos de menores de dezoito anos, representados ou assistidos pelos pais ou representante legal bem como a fim de regular direitos conexos relativos a conteúdo multimídia gerado por inteligência artificial;https://www.camara.leg.br/proposicoesWeb/prop_mostrarintegra?codteor=2873525;https://www.camara.leg.br/proposicoesWeb/fichadetramitacao?idProposicao=2490199;Alteração, Lei de Propriedade Industrial (1996), Lei dos Direitos Autorais (1998), autorização, registro, Pseudônimo, Imagem, Alcunha, Menor de idade, Representante legal, utilização, Inteligência artificial, Artista, Esportista, Atleta, Exploração comercial, Marca de comércio.;Saída de Relator(a) da Comissão - Sem Parecer Apresentado;2025-09-02;Aguardando Designação - Aguardando Devolução de Relator(a) que deixou de ser Membro;0.6085;SIM;0.4407
PL 4348/2025;Projeto de Lei;2025-09-01;Pedro Campos;PSB;Altera a Lei nº 13.819, de 26 de abril de 2019, para incluir a obrigatoriedade de emissão de alertas preventivos por chatbots e sistemas de inteligência artificial em interações relacionadas à saúde mental, automutilação ou suicídio.;https://www.camara.leg.br/proposicoesWeb/prop_mostrarintegra?codteor=2989901;https://www.camara.leg.br/proposicoesWeb/fichadetramitacao?idProposicao=2555351;Alteração, Lei Federal, obrigatoriedade, Plataforma digital, Chatbot, Sistema de inteligência artificial, Aviso de alerta, interação, usuário, conteúdo digital, saúde mental, Automutilação, suicídio,;Notificação de Apensação;2025-11-10;Aguardando Parecer;0.6081;SIM;0.4402
PL 3088/2024;Projeto de Lei;2024-08-08;Júnior Mano;PSB;Altera a Consolidação das Leis do Trabalho (CLT) para Altera a Consolidação das Leis do Trabalho (CLT) para dispor sobre a proteção dos trabalhadores frente ao uso da Inteligência Artificial (IA).;https://www.camara.leg.br/proposicoesWeb/prop_mostrarintegra?codteor=2461006;https://www.camara.leg.br/proposicoesWeb/fichadetramitacao?idProposicao=2451411;Alteração, Consolidação das Leis do Trabalho (CLT) (1943), tutela do trabalho, proteção, trabalhador, utilização, boas práticas, inteligência artificial, algoritmo, relações trabalhistas, acesso à informação, transparência, capacitação, saúde ocupacional.;Retirada de Pauta;2025-12-10;Pronta para Pauta;0.6080;SIM;0.4401
PL 1220/2021;Projeto de Lei;2021-04-05;Otto Alencar Filho;PSD;Dispõe sobre a regulamentação da profissão de montador de andaimes e dá outras providências.;https://www.camara.leg.br/proposicoesWeb/prop_mostrarintegra?codteor=1985167;https://www.camara.leg.br/proposicoesWeb/fichadetramitacao?idProposicao=2276545;Regulamentação profissional, montador de andaimes, requisito, jornada de trabalho, remuneração.;Publicação de Proposição;2025-08-27;Aguardando Designação de Relator(a);0.6076;SIM;0.4394
PL 4730/2023;Projeto de Lei;2023-09-27;Delegado Palumbo;MDB;"Incluir a alínea ""m"" no inciso II do artigo 61 do Decreto Lei n° 2.848, de 7 de dezembro de 1940, Código penal, para prever o uso da inteligência artificial como circunstância agravante, e dá outras providências.";https://www.camara.leg.br/proposicoesWeb/prop_mostrarintegra?codteor=2335571;https://www.camara.leg.br/proposicoesWeb/fichadetramitacao?idProposicao=2391592;Alteração, Código Penal (1940), Inteligência artifical, Crime, Estelionato, Rede social digital, Aumento da pena.;Saída de Relator(a) da Comissão - Sem Parecer Apresentado;2025-03-19;Aguardando Designação - Aguardando Devolução de Relator(a) que deixou de ser Membro;0.6067;SIM;0.4382
PL 4025/2023;Projeto de Lei;2023-08-21;Marx Beltrão;PP;Esta lei altera a Lei nº 10.406, de 10 de janeiro de 2002 - Código Civil, e a Lei nº 9.610, de 19 de fevereiro de 1998, dispondo sobre a utilização da imagem de uma pessoa, viva ou falecida, e dos direitos autorais, decorrentes da utilização de inteligência artificial.;https://www.camara.leg.br/proposicoesWeb/prop_mostrarintegra?codteor=2315355;https://www.camara.leg.br/proposicoesWeb/fichadetramitacao?idProposicao=2380982;Alteração, Código Civil (2002), utilização, imagem, pessoa viva, pessoa falecida, manipulação, inteligência artificial, autorização. _Alteração, Lei dos Direitos Autorais (1998), Obra gerada por inteligência artificial, criação, sistema de inteligência artificial, ausência, proteção, direito autoral. _Autorização, utilização, obra intelectual, treinamento, sistema de inteligência artificial.;Publicação de Proposição;2026-02-02;Aguardando Designação de Relator(a);0.6063;SIM;0.4375
PL 2019/2022;Projeto de Lei;2022-07-13;Laercio Oliveira;PP;Regulamenta a profissão de agente de coleta, limpeza e conservação das vias públicas.;https://www.camara.leg.br/proposicoesWeb/prop_mostrarintegra?codteor=2198052;https://www.camara.leg.br/proposicoesWeb/fichadetramitacao?idProposicao=2332472;Regulamentação profissional, Agente de coleta, limpeza e conservação de vias públicas, atribuição, requisito, carga horária, exposição ao perigo, agentes nocivos, garantia, pagamento, adicional.;Desapensação;2025-12-16;Arquivada;0.6060;SIM;0.4371
PL 450/2026;Projeto de Lei;2026-02-10;Rubens Pereira Júnior;PT;Dispõe sobre obrigações de transparência, retenção de registros, rotulagem de conteúdo político gerado ou amplificado por algoritmos no período eleitoral e dá outras providências.;https://www.camara.leg.br/proposicoesWeb/prop_mostrarintegra?codteor=3081152;https://www.camara.leg.br/proposicoesWeb/fichadetramitacao?idProposicao=2602201;Alteração, Lei Geral de Proteção de Dados Pessoais (LGPDP) (2018), Marco Civil da Internet (2014), Código Eleitoral (1965), Lei das Eleições (1997), obrigatoriedade, provedor de conteúdo, plataforma digital, período eleitoral, campanha eleitoral, rotulagem, conteúdo digital, inteligência artificial generativa, manutenção, registro, metadados, combate, desinformação, notícia falsa (fake news), fiscalização, Justiça Eleitoral.;Apresentação de Proposição;2026-02-10;;0.6054;SIM;0.4363
PL 6472/2025;Projeto de Lei;2025-12-16;Marcos Tavares;PDT;Estabelece normas de proteção aos direitos dos consumidores e usuários de serviços de comunicação eletrônica contra práticas abusivas de cobrança automatizada, incluindo chamadas repetitivas, contatos fora dos horários permitidos, falsas representações, uso indevido de voz sintética (deepvoice), spoofing e outras formas de constrangimento digital, impõe obrigações de transparência, consentimento e mecanismos efetivos de recusa de contato, institui regime sancionatório administrativo e civil para infratores, cria mecanismos de indenização direta por abuso e determina diretrizes de governança de dados pessoais aplicáveis, garantindo a compatibilidade com a Lei Geral de Proteção de Dados Pessoais – LGPD (Lei nº 13.709/2018) e demais normas consumeristas e de telecomunicações.;https://www.camara.leg.br/proposicoesWeb/prop_mostrarintegra?codteor=3068901;https://www.camara.leg.br/proposicoesWeb/fichadetramitacao?idProposicao=2597384;Regulamentação, proteção, Privacidade, Conteúdo de usuário, Ligação telefônica, Telemarketing, Cobrança automática, Robocall, Inteligência artificial, simulação, Voz humana, Prática abusiva, Defesa do consumidor.;Publicação de Proposição;2026-02-12;Aguardando Designação de Relator(a);0.6032;SIM;0.4331
PL 3253/2025;Projeto de Lei;2025-07-03;Juninho do Pneu;UNIÃO;Dispõe da profissão de Esteticista Especializado em Bronzeamento Artificial e estabelece normas para a produção, comercialização e fiscalização dos equipamentos e produtos utilizados nessa atividade e dá outras providências.;https://www.camara.leg.br/proposicoesWeb/prop_mostrarintegra?codteor=2949142;https://www.camara.leg.br/proposicoesWeb/fichadetramitacao?idProposicao=2531985;Regulamentação, exercício profissional, esteticista, bronzeamento artificial, diretrizes.;Publicação de Proposição;2025-12-15;Aguardando Designação de Relator(a);0.6026;SIM;0.4323
PL 538/2021;Projeto de Lei;2021-02-23;Ricardo Izar;REPUBLICANOS;Regulamenta o exercício das profissões de Produtor de Eventos e de Técnico de Eventos e institui seu órgão regulamentador.;https://www.camara.leg.br/proposicoesWeb/prop_mostrarintegra?codteor=1965702;https://www.camara.leg.br/proposicoesWeb/fichadetramitacao?idProposicao=2270658;Regulamentação profissional, Produtor de eventos, Técnico de eventos, criação, Associação Nacional dos Produtores e Técnicos de Eventos (ANPROTEC).;Recebimento;2021-04-28;Tramitando em Conjunto;0.6018;SIM;0.4312
PL 7134/2025;Projeto de Lei;2025-12-22;Amom Mandel;CIDADANIA;Altera a Lei nº 12.965, de 23 de abril de 2014 (Marco Civil da Internet), para incluir o princípio fundamental da Não-Discriminação Algorítmica na disciplina do uso da internet no Brasil.;https://www.camara.leg.br/proposicoesWeb/prop_mostrarintegra?codteor=3072674;https://www.camara.leg.br/proposicoesWeb/fichadetramitacao?idProposicao=2599743;Alteração, Marco Civil da Internet (2014), proibição, inteligência artificial generativa, prestação de serviços, serviços essenciais, utilização, algoritmo, reprodução, ampliação, criação, discriminação, diretrizes.;Apresentação de Proposição;2025-12-22;Aguardando Chancela e Publicação do Despacho;0.6008;SIM;0.4297
PL 2562/2022;Projeto de Lei;2022-10-05;Pinheirinho;PP;Regulamenta a profissão de instrutor de armamento e tiro.;https://www.camara.leg.br/proposicoesWeb/prop_mostrarintegra?codteor=2208553;https://www.camara.leg.br/proposicoesWeb/fichadetramitacao?idProposicao=2335291;Regulamentação profissional, instrutor de armamento e tiro, definição, requisito, livre exercício profissional. _Prerrogativa, credenciamento, candidato, aquisição, arma de fogo, obtenção, porte de arma, formação, atleta, tiro esportivo. _Deveres, respeito, vida, integridade física, pessoa, norma de segurança. _Direitos, reconhecimento, prerrogativa, área pública, área privada, compra direta, munição.;Designação de Relator(a);2026-02-11;Aguardando Parecer;0.5994;SIM;0.4277
PL 2149/2022;Projeto de Lei;2022-08-04;Rubens Pereira Júnior;PT;Dispõe sobre a regulamentação da profissão de Porteiro e determina outras providências.;https://www.camara.leg.br/proposicoesWeb/prop_mostrarintegra?codteor=2201391;https://www.camara.leg.br/proposicoesWeb/fichadetramitacao?idProposicao=2333668;Regulamentação profissional, porteiro, atuação, portaria de acesso, área privada, área pública, empresa, residência, condomínio, escola, órgão público. _Realização, controle, acesso, produtos, pessoa, bens, veículo, prevenção, furto, roubo, dano material. _Competência, requisito, direitos, deveres. _Contratação, Regime de tempo parcial.;Saída de Relator(a) da Comissão - Sem Parecer Apresentado;2025-12-16;Aguardando Designação - Aguardando Devolução de Relator(a) que deixou de ser Membro;0.5992;SIM;0.4274
PL 3514/2019;Projeto de Lei;2019-06-13;Joenia Wapichana;REDE;Regulamenta a profissão de Agente Indígena de Saúde (AIS) e Agente Indígena de Saneamento (AISAN), no âmbito do Subsistema de Atenção à Saúde Indígena (SasiSUS), e dá outras providências.;https://www.camara.leg.br/proposicoesWeb/prop_mostrarintegra?codteor=1764455;https://www.camara.leg.br/proposicoesWeb/fichadetramitacao?idProposicao=2207982;Regulamentação profissional, Agente Indígena de Saúde (AIS), Agente Indígena de Saneamento (AISAN), Subsistema de Atenção à Saúde Indígena (SasiSUS), atribuição, saúde, saneamento básico, saneamento ambiental, população indígena.;Retirada de Pauta;2025-09-16;Pronta para Pauta;0.5986;SIM;0.4266
PL 1884/2025;Projeto de Lei;2025-04-28;Luiz Nishimori;PSD;Dispõe sobre a regulação do uso de deepfakes, estabelece penalidades para usos prejudiciais e incentiva o desenvolvimento ético e responsável da tecnologia.;https://www.camara.leg.br/proposicoesWeb/prop_mostrarintegra?codteor=2892233;https://www.camara.leg.br/proposicoesWeb/fichadetramitacao?idProposicao=2500594;Regulamentação, manipulação, tratamento de imagem, voz humana, tecnologia, inteligência artificial, deepfake, desenvolvimento tecnológico, responsabilidade, provedor de aplicações, internet, remoção de conteúdo, diretrizes, ética digital, segurança de dados.;Encerramento de Prazo;2025-10-08;Aguardando Parecer;0.5985;SIM;0.4265
PL 7137/2025;Projeto de Lei;2025-12-22;Amom Mandel;CIDADANIA;Altera a Lei nº 9.394, de 20 de dezembro de 1996 (Lei de Diretrizes e Bases da Educação Nacional), para incluir a literacia e cidadania digital, com ênfase em Inteligência Artificial, como tema transversal na educação básica e superior da rede pública de ensino.;https://www.camara.leg.br/proposicoesWeb/prop_mostrarintegra?codteor=3072678;https://www.camara.leg.br/proposicoesWeb/fichadetramitacao?idProposicao=2599746;Alteração, Lei de Diretrizes e Bases da Educação Nacional (1996), inclusão, currículo escolar, conteúdo educativo, Inteligência artificial generativa, inclusão digital.;Apresentação de Proposição;2025-12-22;Aguardando Despacho do Presidente da Câmara dos Deputados (Chancela);0.5979;SIM;0.4255
PL 5084/2020;Projeto de Lei;2020-11-04;Talíria Petrone;PSOL;Regulamenta a profissão de revisor de textos.;https://www.camara.leg.br/proposicoesWeb/prop_mostrarintegra?codteor=1940228;https://www.camara.leg.br/proposicoesWeb/fichadetramitacao?idProposicao=2264951;Regulamentação profissional, Revisor de textos.;Distribuição;2023-03-28;Aguardando Designação de Relator(a);0.5969;SIM;0.4241
PL 2820/2024;Projeto de Lei;2024-07-10;Erika Kokay;PT;Dispõe sobre a transparência a ser adotada pelos Órgãos de Inteligência das Forças Armadas e Forças Auxiliares.;https://www.camara.leg.br/proposicoesWeb/prop_mostrarintegra?codteor=2452984;https://www.camara.leg.br/proposicoesWeb/fichadetramitacao?idProposicao=2448348;Critério, Órgão de inteligência, Forças Armadas, Força auxiliar, investigação, cidadão, obrigatoriedade, autorização judicial, diretrizes, transparência pública.;Recebimento - Relator(a) (Sem Manifestação);2026-02-10;Aguardando Designação de Relator(a);0.5938;SIM;0.4196
PL 822/2019;Projeto de Lei;2019-02-14;Eduardo Bismarck;PDT;Dispõe sobre a regulamentação profissional de Instalador e Mecânico de sistema de ar condicionado.;https://www.camara.leg.br/proposicoesWeb/prop_mostrarintegra?codteor=1710885;https://www.camara.leg.br/proposicoesWeb/fichadetramitacao?idProposicao=2192210;Regulamentação profissional, instalador e mecânico de sistemas de ar condicionado, requisito.;Distribuição;2023-03-28;Aguardando Designação de Relator(a);0.5923;SIM;0.4175
