Norma;Descricao da Sigla;Data de Apresentacao;Autor;Partido;Ementa;Link Documento PDF;Link Página Web;Indexacao;Último Estado;Data Último Estado;Situação;Score Final;Boost Keyword;Similaridade Semantica
PL 1559/2024;Projeto de Lei;2024-05-06;Professora Luciene Cavalcante;PSOL;Altera a Lei nº 9.394, de 20 de dezembro de 1996 (Lei de Diretrizes e Bases da Educação Nacional), para vedar o uso de inteligência artificial como parâmetro de referência e de métrica para o desenvolvimento de material pedagógico, bem como ferramenta de avaliação de desempenho escolar, a ser utilizado pela rede pública de ensino das unidades da Federação, e dá outras providências correlatas.;https://www.camara.leg.br/proposicoesWeb/prop_mostrarintegra?codteor=2416673;https://www.camara.leg.br/proposicoesWeb/fichadetramitacao?idProposicao=2430998;Alteração, Lei de Diretrizes e Bases da Educação Nacional (1996), critério, proibição, utilização, Inteligência artificial, elaboração, material pedagógico, educação básica, educação superior, avaliação, rendimento escolar.;Recebimento - Relator(a) (Sem Manifestação);2025-04-09;Aguardando Designação de Relator(a);0.6855;SIM;0.5507
PL 3936/2024;Projeto de Lei;2024-10-14;Leonardo Gadelha;PODE;Altera a Lei nº 9.279, de 14 de maio de 1996, para dispor sobre a obtenção de patentes de invenções ou modelos de utilidade desenvolvidos com o auxílio de sistemas de inteligência artificial.;https://www.camara.leg.br/proposicoesWeb/prop_mostrarintegra?codteor=2484809;https://www.camara.leg.br/proposicoesWeb/fichadetramitacao?idProposicao=2462314;Alteração, Lei de Propriedade Industrial (1996), Patente de invenção, Modelo de utilidade, utilização, inteligência artificial, Instituto Nacional da Propriedade Industrial (INPI), diretrizes.;Notificações;2025-06-11;Tramitando em Conjunto;0.6854;SIM;0.5506
PL 1522/2024;Projeto de Lei;2024-05-02;Julio Lopes;PP;Dispõe sobre a utilização de ferramentas tecnológicas de inteligência artificial para gestão e manutenção de dados no Sistema Único de Saúde em todo território nacional;https://www.camara.leg.br/proposicoesWeb/prop_mostrarintegra?codteor=2416098;https://www.camara.leg.br/proposicoesWeb/fichadetramitacao?idProposicao=2430744;Regulamentação, utilização, Inteligência artificial, gestão, manutenção, Sistema Único de Saúde (SUS), Inovação tecnológica, identificação, cadastro, Usuário, condição específica, Leilão reverso.;Encerramento de Prazo;2025-05-27;Pronta para Pauta;0.6841;SIM;0.5488
PL 1547/2023;Projeto de Lei;2023-03-30;Rafael Prudente;MDB;Regulamenta a profissão de criador de conteúdo digital e dá outras providências.;https://www.camara.leg.br/proposicoesWeb/prop_mostrarintegra?codteor=2253190;https://www.camara.leg.br/proposicoesWeb/fichadetramitacao?idProposicao=2354446;Regulamentação profissional, Criador de Conteúdo Digital, Competência profissional, direitos, deveres, Exercício profissional, diretrizes.;Notificacao para Publicação Intermediária;2025-10-14;Tramitando em Conjunto;0.6841;SIM;0.5487
PL 3800/2023;Projeto de Lei;2023-08-08;Acácio Favacho;MDB;Altera o art. 171 do Decreto-Lei nº 2.848, de 7 de dezembro de 1940 – Código Penal, para aumentar a pena do crime de fraude eletrônica quando a conduta for praticada com a utilização de inteligência artificial.;https://www.camara.leg.br/proposicoesWeb/prop_mostrarintegra?codteor=2307704;https://www.camara.leg.br/proposicoesWeb/fichadetramitacao?idProposicao=2376427;Alteração, Código Penal (1940), Crime contra o patrimônio, aumento da pena, fraude eletrônica, utilização, inteligência artificial.;Recebimento;2023-08-21;Tramitando em Conjunto;0.6831;SIM;0.5473
PL 2225/2025;Projeto de Lei;2025-05-09;Helio Lopes;PL;Dispõe sobre a criação da Política Nacional de Formação e Capacitação de Professores da Educação Básica em Inteligência Artificial como Assistente Pedagógico para o Desenvolvimento do Ensino e Aprendizagem e dá outras providências.;https://www.camara.leg.br/proposicoesWeb/prop_mostrarintegra?codteor=2903061;https://www.camara.leg.br/proposicoesWeb/fichadetramitacao?idProposicao=2507228;Criação, Política Nacional de Formação e Capacitação de Professores da Educação Básica em Inteligência Artificial como Assistente Pedagógico, diretrizes, educação e formação profissional, professor, educação básica, profissional da educação, educação digital, tecnologia, inclusão digital.;Encerramento de Prazo;2025-07-02;Aguardando Parecer;0.6831;SIM;0.5472
PL 4416/2025;Projeto de Lei;2025-09-03;Aureo Ribeiro;SOLIDARIEDADE;Altera a Lei nº 13.819, de 26 de abril de 2019, que institui a Política Nacional de Prevenção da Automutilação e do Suicídio, para instituir salvaguardas obrigatórias em sistemas de inteligência artificial.;https://www.camara.leg.br/proposicoesWeb/prop_mostrarintegra?codteor=2992652;https://www.camara.leg.br/proposicoesWeb/fichadetramitacao?idProposicao=2556998;Alteração, Política Nacional de Prevenção da Automutilação e do Suicídio, Lei Federal, obrigatoriedade, empresa, inteligência artificial generativa, critério, identificação, registro, notificação, referência, suicídio, automutilação, diretrizes.;Apensação;2025-11-10;Tramitando em Conjunto;0.6830;SIM;0.5472
PL 2721/2024;Projeto de Lei;2024-07-03;Jonas Donizette;PSB;Altera o art. 11 da Lei n° 9.610, de 1998, para deixar expresso que autor é apenas a pessoa física, independentemente do grau de autonomia do sistema de inteligência artificial utilizado na elaboração da obra.;https://www.camara.leg.br/proposicoesWeb/prop_mostrarintegra?codteor=2446536;https://www.camara.leg.br/proposicoesWeb/fichadetramitacao?idProposicao=2445849;Alteração, Lei dos Direitos Autorais (1998), garantia, direito autoral, pessoa física, obra intelectual, independência, Sistema de inteligência artificial.;Retirada de Pauta;2025-11-19;Pronta para Pauta;0.6830;SIM;0.5471
PL 5694/2023;Projeto de Lei;2023-11-24;Fred Linhares;REPUBLICANOS;Criminaliza a manipulação ou adulteração de fotos, vídeos ou sons, utilizando-se de sistemas de inteligência artificial, com o intuito de causar constrangimento, humilhação, assédio, ameaça ou qualquer outro tipo de violência contra crianças ou adolescentes, além disso, aumenta a pena para crimes relacionados à pornografia infantil na hipótese de uso de inteligência artificial, se a cena de sexo explícito ou pornográfica envolvendo criança ou adolescente for manipulada ou adulterada por meio de sistema de inteligência artificial.;https://www.camara.leg.br/proposicoesWeb/prop_mostrarintegra?codteor=2364226;https://www.camara.leg.br/proposicoesWeb/fichadetramitacao?idProposicao=2406508;Alteração, Estatuto da Criança e do Adolescente (ECA), criminalização, manipulação, adulteração, fotografia, vídeo, som, utilização, inteligência artificial, intenção, provocação, constrangimento, humilhação, assédio moral, contra, criança, adolescente. _Aumento da pena, cena de sexo, cena pornográfica, envolvimento, criança, adolescente, manipulação, adulteração, realização, inteligência artificial.;Apresentação de Requerimento;2025-08-12;Aguardando Parecer;0.6828;SIM;0.5469
PL 6172/2025;Projeto de Lei;2025-12-03;Zé Neto;PT;Dispõe sobre tutela dos autores de obras artísticas, científicas e literárias criadas a partir de sistemas de inteligência artificial e estabelece critérios para a produção e divulgação de conteúdos sintéticos.;https://www.camara.leg.br/proposicoesWeb/prop_mostrarintegra?codteor=3059720;https://www.camara.leg.br/proposicoesWeb/fichadetramitacao?idProposicao=2592508;Regulamentação, Direito autoral, Obra gerada por inteligência artificial, Propriedade intelectual, litígio, titularidade.;Apresentação de Proposição;2025-12-03;Aguardando Despacho do Presidente da Câmara dos Deputados (Chancela);0.6819;SIM;0.5456
PL 2687/2025;Projeto de Lei;2025-06-02;João Daniel;PT;Altera o Decreto-Lei nº 2.848, de 7 de dezembro de 1940 (Código Penal), para tipificar como crime a omissão de identificação de conteúdo hiper-realista gerado por inteligência artificial com potencial de enganar terceiros.;https://www.camara.leg.br/proposicoesWeb/prop_mostrarintegra?codteor=2924692;https://www.camara.leg.br/proposicoesWeb/fichadetramitacao?idProposicao=2519991;Alteração, Código Penal (1940), Tipificação de conduta, Crime, omissão, identificação, Conteúdo audiovisual, Conteúdo digital, criação, Inteligência artificial, Deepfake.;Publicação de Proposição;2025-06-26;Aguardando Designação de Relator(a);0.6806;SIM;0.5437
PL 791/2023;Projeto de Lei;2023-03-02;Emanuel Pinheiro Neto;MDB;Estabelece procedimentos a serem adotados pela União em regime de colaboração com os Estados, Distrito Federal e Municípios em situação de riscos e desastres mediante o uso de Sistemas de Processamento de Dados e de Inteligência Artificial (IA), com objetivo na organização, solução e implementação integrada e da outras providências.;https://www.camara.leg.br/proposicoesWeb/prop_mostrarintegra?codteor=2238986;https://www.camara.leg.br/proposicoesWeb/fichadetramitacao?idProposicao=2349820;Colaboração, União, Estado (ente federado), Distrito Federal (Brasil), Município, Sistema computacional, Processamento de Dados, Inteligência artificial, Situação de risco, desastre ambiental, Desastre humano, prevenção, fiscalização, desmatamento, exploração florestal, proteção ambiental, diretrizes.;Designação de Relator(a);2025-06-02;Aguardando Parecer;0.6793;SIM;0.5418
PL 3783/2025;Projeto de Lei;2025-08-06;Prof. Reginaldo Veras;PV;Dispõe sobre a obrigatoriedade de advertências, recomendações etárias e limites de uso consciente de ferramentas de inteligência artificial, com foco na prevenção de danos à saúde mental, especialmente entre crianças, adolescentes e pessoas com transtornos mentais diagnosticados. Estabelece diretrizes para campanhas educativas, pesquisas públicas e responsabilização de desenvolvedores e provedores.;https://www.camara.leg.br/proposicoesWeb/prop_mostrarintegra?codteor=2967927;https://www.camara.leg.br/proposicoesWeb/fichadetramitacao?idProposicao=2541086;Obrigatoriedade, Plataforma digital, Internet, Software aplicativo, sistema de informação, escola, utilização, inteligência artificial, Classificação indicativa, faixa etária, proteção, saúde mental, criança, adolescente, Pessoa com transtorno mental, diretrizes.;Recebimento;2025-09-23;Tramitando em Conjunto;0.6792;SIM;0.5417
PL 2775/2024;Projeto de Lei;2024-07-08;João Daniel;PT;Altera a Lei nº 13.709, de 14 de agosto de 2018, Lei Geral de Proteção de Dados Pessoais (LGPD), para determinar critérios à permissão do uso dos dados pessoais para o treinamento e aperfeiçoamento de sistemas de inteligência artificial (IA).;https://www.camara.leg.br/proposicoesWeb/prop_mostrarintegra?codteor=2450495;https://www.camara.leg.br/proposicoesWeb/fichadetramitacao?idProposicao=2447165;Alteração, Lei Geral de Proteção de Dados Pessoais (LGPDP) (2018), regulamentação, utilização, dados pessoais, Sistema de inteligência artificial.;Apresentação de Requerimento;2025-08-05;Aguardando Parecer;0.6778;SIM;0.5397
PL 4369/2025;Projeto de Lei;2025-09-02;Marcos Tavares;PDT;Institui a obrigatoriedade do uso de câmeras corporais inteligentes, integradas a sistemas de Inteligência Artificial, pelas Polícias Militares e Civis em todo o território nacional, e dá outras providências.;https://www.camara.leg.br/proposicoesWeb/prop_mostrarintegra?codteor=2990836;https://www.camara.leg.br/proposicoesWeb/fichadetramitacao?idProposicao=2555890;Obrigatoriedade, Câmera corporal, integração, Sistema de inteligência artificial, Policial, diretrizes.;Encerramento de Prazo;2026-02-09;Aguardando Parecer;0.6773;SIM;0.5390
PL 2224/2025;Projeto de Lei;2025-05-09;Helio Lopes;PL;Institui a Política Nacional de Educação em Inteligência Artificial e Ciência da Computação, visando à modernização do ensino, à capacitação de estudantes e professores, e ao desenvolvimento socioeconômico e tecnológico do País.;https://www.camara.leg.br/proposicoesWeb/prop_mostrarintegra?codteor=2903057;https://www.camara.leg.br/proposicoesWeb/fichadetramitacao?idProposicao=2507224;Criação, Política Nacional de Educação em Inteligência Artificial e Ciência da Computação, diretrizes, educação digital, letramento algorítmico, desenvolvimento tecnológico.;Encerramento de Prazo;2025-06-26;Aguardando Parecer;0.6772;SIM;0.5388
PL 3236/2024;Projeto de Lei;2024-08-20;Júnior Mano;PSB;Dispõe sobre a proteção dos direitos de propriedade intelectual dos atletas, regulamentando o registro e a exploração de movimentos esportivos, marcas pessoais, o uso da imagem dos atletas para fins comerciais e o uso de Inteligência Artificial no contexto esportivo, e dá outras providências.;https://www.camara.leg.br/proposicoesWeb/prop_mostrarintegra?codteor=2467213;https://www.camara.leg.br/proposicoesWeb/fichadetramitacao?idProposicao=2454171;Diretrizes, proteção, direito de propriedade intelectual, direito autoral, atleta, regulamentação, registro, exploração, comercialização, utilização, inteligência artificial, esporte, setor esportivo, Instituto Nacional da Propriedade Industrial (INPI).;Encerramento de Prazo;2025-08-07;Aguardando Parecer;0.6770;SIM;0.5386
PL 177/2024;Projeto de Lei;2024-02-06;Saullo Vianna;UNIÃO;“Institui a Campanha de Conscientização e Prevenção contra Crimes Cibernéticos, cometidos por meio do uso indevido da inteligência artificial, contra crianças e adolescentes.”;https://www.camara.leg.br/proposicoesWeb/prop_mostrarintegra?codteor=2385470;https://www.camara.leg.br/proposicoesWeb/fichadetramitacao?idProposicao=2417362;Criação, Campanha de Conscientização e Prevenção contra Crimes Cibernéticos, Cometidos por meio do Uso Indevido da Inteligência Artificial, contra Crianças e Adolescentes, diretrizes.;Abertura de Prazo;2025-12-16;Aguardando Parecer;0.6763;SIM;0.5376
PL 3009/2025;Projeto de Lei;2025-06-23;David Soares;UNIÃO;Altera a Lei nº 9.394, de 20 de dezembro de 1996, para estabelecer como componente curricular o ensino da  Inteligência Artificial.;https://www.camara.leg.br/proposicoesWeb/prop_mostrarintegra?codteor=2939428;https://www.camara.leg.br/proposicoesWeb/fichadetramitacao?idProposicao=2527346;Alteração, Lei de Diretrizes e Bases da Educação Nacional (1996), critério, obrigatoriedade, instituição de ensino, educação básica, conteúdo programático, ética digital, utilização, inteligência artificial, diretrizes.;Recebimento;2025-09-23;Tramitando em Conjunto;0.6752;SIM;0.5360
PL 5792/2025;Projeto de Lei;2025-11-11;Marcos Tavares;PDT;Institui a Lei Nacional de Observatórios de Transparência em Licitações com Inteligência Artificial (IA), para auditoria automatizada e contínua de editais, contratos e processos licitatórios no âmbito da administração pública direta e indireta, e dá outras providências.;https://www.camara.leg.br/proposicoesWeb/prop_mostrarintegra?codteor=3044180;https://www.camara.leg.br/proposicoesWeb/fichadetramitacao?idProposicao=2583785;Criação, Lei Nacional de Observatórios de Transparência em Licitações com Inteligência Artificial - IA, auditoria, tempo real, utilização, inteligência artificial, edital, contrato administrativo, licitação, administração pública, diretrizes.;Publicação de Proposição;2026-02-02;Aguardando Designação de Relator(a);0.6749;SIM;0.5355
PL 4358/2025;Projeto de Lei;2025-09-02;Romero Rodrigues;PODE;Institui princípios, objetivos, diretrizes, direitos, deveres, instrumentos de gestão de risco e de transparência, bem como mecanismos de fomento, fiscalização e governança para o desenvolvimento e o uso ético e responsável de sistemas de Inteligência Artificial no Brasil, e dá outras providências.;https://www.camara.leg.br/proposicoesWeb/prop_mostrarintegra?codteor=2990583;https://www.camara.leg.br/proposicoesWeb/fichadetramitacao?idProposicao=2555663;Diretrizes, Gerenciamento de risco, governança, transparência, uso responsável, Sistema de inteligência artificial.;Recebimento;2025-09-23;Tramitando em Conjunto;0.6743;SIM;0.5348
PL 453/2026;Projeto de Lei;2026-02-10;Pastor Sargento Isidório;AVANTE;Estabelece a obrigatoriedade de inserção de selo, marca d’água ou aviso visível em vídeos, imagens, áudios e demais conteúdos digitais produzidos total ou parcialmente por sistemas de Inteligência Artificial e veiculados no Brasil, inclusive em redes sociais, plataformas digitais e aplicativos de mensagens, com o objetivo de prevenir a desinformação, proteger a honra, a imagem, a privacidade dos cidadãos e coibir usos nocivos da tecnologia e dá outras providências.;https://www.camara.leg.br/proposicoesWeb/prop_mostrarintegra?codteor=3081317;https://www.camara.leg.br/proposicoesWeb/fichadetramitacao?idProposicao=2602287;Obrigatoriedade, marcação, aviso, identificação, vídeo, imagem, som, conteúdo digital, utilização, inteligência artificial generativa, diretrizes.;Apresentação de Proposição;2026-02-10;;0.6743;SIM;0.5347
PL 7174/2025;Projeto de Lei;2025-12-22;Amom Mandel;CIDADANIA;Institui o Selo Nacional de Ética Algorítmica para Produtos Educacionais Digitais utilizados por instituições públicas de ensino e dá outras providências.;https://www.camara.leg.br/proposicoesWeb/prop_mostrarintegra?codteor=3072721;https://www.camara.leg.br/proposicoesWeb/fichadetramitacao?idProposicao=2599783;Criação, selo de certificação, ética digital, algoritmo, educação, inteligência artificial, tecnologia interativa digital de informação e comunicação (TIDIC), proteção, dados pessoais, transparência, diretrizes.;Apresentação de Proposição;2025-12-22;Aguardando Chancela e Publicação do Despacho;0.6729;SIM;0.5327
PL 240/2026;Projeto de Lei;2026-02-04;Carlos Henrique Gaguim;UNIÃO;Altera a Lei nº 11.326, de 24 de julho de 2006, para instituir sistema informatizado com recursos de inteligência artificial no âmbito da agricultura familiar.;https://www.camara.leg.br/proposicoesWeb/prop_mostrarintegra?codteor=3078303;https://www.camara.leg.br/proposicoesWeb/fichadetramitacao?idProposicao=2600713;Alteração, Lei da Agricultura Familiar (2006), Política Nacional da Agricultura Familiar e Empreendimentos Familiares Rurais, disponibilização, tecnologia, Inteligência artificial generativa,  Agricultura familiar, Empresa familiar rural.;Apresentação de Proposição;2026-02-04;;0.6716;SIM;0.5308
PL 349/2024;Projeto de Lei;2024-02-21;Maria Rosas;REPUBLICANOS;Institui campanha de prevenção e combate aos crimes digitais contra crianças, adolescentes e pessoas com deficiência praticados com o suporte de ferramentas de inteligência artificial.;https://www.camara.leg.br/proposicoesWeb/prop_mostrarintegra?codteor=2388131;https://www.camara.leg.br/proposicoesWeb/fichadetramitacao?idProposicao=2418314;Criação, Campanha de Conscientização e Prevenção contra Crimes Cibernéticos, Cometidos por meio do Uso Indevido da Inteligência Artificial, contra Crianças e Adolescentes, pessoa com deficiência, diretrizes.;Notificacao para Publicação Intermediária;2025-12-15;;0.6712;SIM;0.5303
PL 2148/2022;Projeto de Lei;2022-08-04;Rubens Pereira Júnior;PT;Dispõe sobre a regulamentação da profissão de Vigia e dá outras providências.;https://www.camara.leg.br/proposicoesWeb/prop_mostrarintegra?codteor=2201390;https://www.camara.leg.br/proposicoesWeb/fichadetramitacao?idProposicao=2333667;Regulamentação profissional, Vigia, execução, atividade, observação, fiscalização, imóvel, perímetro urbano, área rural, proteção, lugar. _Competência, direitos, deveres.;Recebimento;2023-11-17;Tramitando em Conjunto;0.6700;SIM;0.5286
PL 1956/2025;Projeto de Lei;2025-04-29;Rafael Prudente;MDB;Altera a Lei nº 9.394, de 20 de dezembro de 1996, que estabelece diretrizes e bases da educação nacional, para prever o ensino dos fundamentos da Inteligência Artificial (IA) no currículo do ensino fundamental e do ensino médio.;https://www.camara.leg.br/proposicoesWeb/prop_mostrarintegra?codteor=2895089;https://www.camara.leg.br/proposicoesWeb/fichadetramitacao?idProposicao=2502546;Alteração, Lei de Diretrizes e Bases da Educação Nacional (1996), inserção, currículo escolar, ensino fundamental, ensino médio, tecnologia digital, inteligência artificial, pensamento computacional, ética digital, educação tecnológica, aplicação, impacto social, impacto econômico, Inclusão digital, Inclusão tecnológica.;Encerramento de Prazo;2025-07-02;Aguardando Parecer;0.6683;SIM;0.5261
PL 3379/2023;Projeto de Lei;2023-07-04;Neto Carletto;AVANTE;Altera a Lei nº 9.394, de 20 de dezembro de 1996, de diretrizes e bases da educação nacional, para dispor sobre a inclusão do ensino de Inteligência Artificial no ensino médio.;https://www.camara.leg.br/proposicoesWeb/prop_mostrarintegra?codteor=2296507;https://www.camara.leg.br/proposicoesWeb/fichadetramitacao?idProposicao=2372533;Alteração, Lei de Diretrizes e Bases da Educação Nacional (1996), inclusão, Disciplina obrigatória, Inteligência artificial, ensino médio.;Apensação;2025-03-13;Tramitando em Conjunto;0.6668;SIM;0.5240
PL 4308/2025;Projeto de Lei;2025-08-28;Tião Medeiros;PP;Altera a Lei no 12.965, de 23 de abril de 2014 (Marco Civil da Internet), para dispor sobre a obrigatoriedade de aviso ao usuário do emprego de ferramentas de inteligência artificial em aplicação de internet.;https://www.camara.leg.br/proposicoesWeb/prop_mostrarintegra?codteor=2988307;https://www.camara.leg.br/proposicoesWeb/fichadetramitacao?idProposicao=2554623;Alteração, Marco Civil da Internet (2014), obrigatoriedade, provedor de aplicações, aviso, utilização, inteligência artificial, conteúdo digital, diretrizes.;Recebimento;2025-09-23;Tramitando em Conjunto;0.6653;SIM;0.5219
PL 842/2024;Projeto de Lei;2024-03-19;Ruy Carneiro;PODE;Altera a Lei no 12.965, de 23 de abril de 2014 (Marco Civil da Internet), para dispor sobre a obrigatoriedade de que aplicações de internet que se utilizem de mecanismos de inteligência artificial para a geração de conteúdos audiovisuais insiram sinalização nos conteúdos produzidos.;https://www.camara.leg.br/proposicoesWeb/prop_mostrarintegra?codteor=2396789;https://www.camara.leg.br/proposicoesWeb/fichadetramitacao?idProposicao=2421855;Alteração, Marco Civil da Internet (2014), obrigatoriedade, Aviso de alerta, Aplicação de internet, utilização, Inteligência artificial, Conteúdo audiovisual, Crime cibernético, Rede social digital;Recebimento;2024-03-25;Tramitando em Conjunto;0.6647;SIM;0.5210
PL 5433/2025;Projeto de Lei;2025-10-28;Antonio Carlos Rodrigues;PL;Estabelece diretrizes nacionais para o uso de sistemas de inteligência artificial na área da saúde, com vistas à segurança do paciente, à qualidade assistencial, à transparência, à responsabilização e à proteção de dados pessoais.;https://www.camara.leg.br/proposicoesWeb/prop_mostrarintegra?codteor=3031315;https://www.camara.leg.br/proposicoesWeb/fichadetramitacao?idProposicao=2577251;Regulamentação, utilização, inteligência artificial, Saúde, diretrizes.;Apresentação de Proposição;2025-10-28;Aguardando Despacho do Presidente da Câmara dos Deputados (Chancela);0.6633;SIM;0.5190
PL 1996/2021;Projeto de Lei;2021-05-28;Paulo Abi-Ackel;PSDB;Regulamenta a profissão de Agente de Proteção da Aviação Civil - APAC, e dá outras providências.;https://www.camara.leg.br/proposicoesWeb/prop_mostrarintegra?codteor=2020318;https://www.camara.leg.br/proposicoesWeb/fichadetramitacao?idProposicao=2285141;Regulamentação profissional, Agente de Proteção da Aviação Civil (APAC), requisito, atividade profissional, registro, atribuição, carga horária, piso salarial.;Encerramento de Prazo;2023-07-07;Aguardando Designação - Aguardando Devolução de Relator(a) que deixou de ser Membro;0.6632;SIM;0.5189
PL 4510/2020;Projeto de Lei;2020-09-09;Afonso Florence;PT;"Estabelece nova definição sobre o que se entende como atividade de inteligência do Estado, dispõe sobre a tipificação criminal do desvio de finalidade em atividades inerentes aos serviços de inteligência e altera a Lei nº 9.883, de 7 de dezembro de 1999 (Cria o Sistema Brasileiro de Inteligência e a ABIN); e a Lei nº 13.869, de 5 de setembro de 2019 (Crimes de Abuso de Autoridade).";https://www.camara.leg.br/proposicoesWeb/prop_mostrarintegra?codteor=1929005;https://www.camara.leg.br/proposicoesWeb/fichadetramitacao?idProposicao=2262414;Alteração, Lei da Agência Brasileira de Inteligência, definição, atividade de inteligência, inteligência de Estado, finalidade, preservação, soberania nacional, defesa, Estado democrático de direito. _Alteração, Lei de Abuso de Autoridade (2019), tipificação de conduta, desvio de poder, atividade, inteligência de Estado, violação de intimidade, liberdade de expressão, liberdade de pensamento, produção, obtenção, compartilhamento, informação, vida privada, ideologia política, atividade cívica.;Designação de Relator(a);2025-08-07;Aguardando Parecer;0.6616;SIM;0.5165
