Norma;Descricao da Sigla;Data de Apresentacao;Autor;Partido;Ementa;Link Documento PDF;Link Página Web;Indexacao;Último Estado;Data Último Estado;Situação;Score Final;Boost Keyword;Similaridade Semantica
PL 759/2023;Projeto de Lei;2023-03-01;Lebrão;UNIÃO;Regulamenta os sistemas de Inteligência Artificial, e dá outras providências.;https://www.camara.leg.br/proposicoesWeb/prop_mostrarintegra?codteor=2238606;https://www.camara.leg.br/proposicoesWeb/fichadetramitacao?idProposicao=2349685;Regulamentação, Inteligência artificial, sistema computacional, parâmetro, segurança jurídica, investimento, pesquisa e desenvolvimento, desenvolvimento tecnológico, inovação, plataforma digital. _Inteligência artificial, diretrizes, criação, Política Nacional de Inteligência Artificial, tecnologia cognitiva.;Apresentação de Requerimento;2025-08-05;Aguardando Parecer;0.9221;SIM;0.8887
PL 240/2020;Projeto de Lei;2020-02-11;Léo Moraes;PODE;Cria a Lei da Inteligência Artificial, e dá outras providências.;https://www.camara.leg.br/proposicoesWeb/prop_mostrarintegra?codteor=1857143;https://www.camara.leg.br/proposicoesWeb/fichadetramitacao?idProposicao=2236943;Criação, legislação, diretrizes, Inteligência artificial, segurança jurídica, investimento, pesquisa e desenvolvimento, produtos, serviços, tecnologia cognitiva, Política Nacional de Inteligência Artificial.;Desapensação;2021-09-29;Arquivada;0.8804;SIM;0.8292
PL 5303/2023;Projeto de Lei;2023-11-01;Renata Abreu;PODE;Dispõe sobre a prestação de serviços mediante o uso de inteligência artificial.;https://www.camara.leg.br/proposicoesWeb/prop_mostrarintegra?codteor=2354386;https://www.camara.leg.br/proposicoesWeb/fichadetramitacao?idProposicao=2400917;Requisito, utilização, inteligência artificial, prestação de serviços, pessoa física, pessoa jurídica, diretrizes.;Designação de Relator(a);2025-05-20;Aguardando Parecer;0.8561;SIM;0.7945
PL 1969/2021;Projeto de Lei;2021-05-26;Gustavo Fruet;PDT;Dispõe sobre os princípios, direitos e obrigações na utilização de sistemas de inteligência artificial.;https://www.camara.leg.br/proposicoesWeb/prop_mostrarintegra?codteor=2018899;https://www.camara.leg.br/proposicoesWeb/fichadetramitacao?idProposicao=2284814;Princípios, direitos, obrigações, Utilização, Inteligência artificial.;Desapensação;2021-09-29;Arquivada;0.8520;SIM;0.7886
PL 4719/2023;Projeto de Lei;2023-09-27;Dimas Gadelha;PT;Dispõe sobre o incentivo ao desenvolvimento de inteligência artificial.;https://www.camara.leg.br/proposicoesWeb/prop_mostrarintegra?codteor=2335296;https://www.camara.leg.br/proposicoesWeb/fichadetramitacao?idProposicao=2391466;Alteração, Lei de Informática (1991), Lei Federal, recursos, Fundo Nacional de Desenvolvimento Científico e Tecnológico (FNDCT), Fundo setorial, Fundo do Agronegócio (CT-Agronegócio), Fundo Aeronáutico (CT-Aeronáutico), Fundo de Biotecnologia (CT-Biotecnologia), Fundo de Energia (CT-Energ), Fundo Espacial (CT-Espacial), CT-Hidro, Fundo Inovar-Auto (CT-Inovar-Auto), CT-Saúde, investimento, Inteligência artificial.;Encerramento de Prazo;2025-10-08;Aguardando Parecer;0.8501;SIM;0.7859
PL 6237/2025;Projeto de Lei;2025-12-08;Poder Executivo;N/A;Institui o Sistema Nacional para Desenvolvimento, Regulação e Governança de Inteligência Artificial.;https://www.camara.leg.br/proposicoesWeb/prop_mostrarintegra?codteor=3063060;https://www.camara.leg.br/proposicoesWeb/fichadetramitacao?idProposicao=2594000;Criação, Sistema Nacional para Desenvolvimento, Regulação e Governança de Inteligência Artificial (SIA), regulamentação, Inteligência artificial, desenvolvimento tecnológico, segurança cibernética, Segurança de dados, preservação, direitos fundamentais, diretrizes.;Apresentação de Requerimento;2025-12-11;Aguardando Despacho do Presidente da Câmara dos Deputados (Chancela);0.8494;SIM;0.7849
PL 2008/2024;Projeto de Lei;2024-05-22;Vinicius Carvalho;REPUBLICANOS;Dispõe sobre a prevenção e repressão às infrações contra a ordem econômica através do uso de Inteligência Artificial (IA) para efetuar práticas desleais de concorrência.;https://www.camara.leg.br/proposicoesWeb/prop_mostrarintegra?codteor=2427972;https://www.camara.leg.br/proposicoesWeb/fichadetramitacao?idProposicao=2435976;Alteração, Lei de Defesa da Concorrência (2011), Infração contra a ordem econômica, utilização, Inteligência artificial, Concorrência desleal.;Publicação de Proposição;2024-06-20;Tramitando em Conjunto;0.8131;SIM;0.7331
PL 526/2025;Projeto de Lei;2025-02-18;Marx Beltrão;PP;DISPÕE SOBRE A REGULAÇÃO DO USO DA INTELIGÊNCIA ARTIFICIAL NO BRASIL E DÁ OUTRAS PROVIDÊNCIAS.;https://www.camara.leg.br/proposicoesWeb/prop_mostrarintegra?codteor=2857071;https://www.camara.leg.br/proposicoesWeb/fichadetramitacao?idProposicao=2484379;Regulação, inteligência artificial, Brasil, diretrizes, sistema de inteligência artificial.;Recebimento;2025-03-25;Tramitando em Conjunto;0.7977;SIM;0.7109
PL 6326/2025;Projeto de Lei;2025-12-10;Marcos Tavares;PDT;Institui a Lei de Rotulagem de Conteúdo Sintético e de Transparência em Inteligência Artificial, dispondo sobre a obrigatoriedade de identificação de conteúdos gerados, manipulados ou alterados por sistemas de inteligência artificial, com vistas à proteção da informação, da democracia, do consumidor e dos direitos fundamentais no ambiente digital, e altera a Lei nº 12.965, de 23 de abril de 2014 (Marco Civil da Internet).;https://www.camara.leg.br/proposicoesWeb/prop_mostrarintegra?codteor=3065500;https://www.camara.leg.br/proposicoesWeb/fichadetramitacao?idProposicao=2595639;Regulamentação, Conteúdo sintético, Sistema de inteligência artificial, Confiança digital, Transparência algorítmica. _ Obrigatoriedade, Plataforma digital, rastreabilidade, identificação, rotulagem, conteúdo digital, Inteligência artificial generativa, Moderação de conteúdo, garantia, Direito à informação, Direito do consumidor. _ Alteração, Marco Civil da Internet (2014), Responsabilidade administrativa, Responsabilidade solidária, provedor de aplicações, internet.;Apresentação de Proposição;2025-12-10;Aguardando Despacho do Presidente da Câmara dos Deputados (Chancela);0.7884;SIM;0.6977
PL 6248/2025;Projeto de Lei;2025-12-09;Coronel Chrisóstomo;PL;Dispõe sobre a utilização de sistemas de inteligência artificial nas atividades de análise de inteligência policial, estabelecendo princípios éticos, definições técnicas, limites de uso, diretrizes para supervisão humana e autoriza o uso de IA na análise de comunicações legalmente interceptadas.;https://www.camara.leg.br/proposicoesWeb/prop_mostrarintegra?codteor=3063479;https://www.camara.leg.br/proposicoesWeb/fichadetramitacao?idProposicao=2594273;Utilização, Inteligência artificial, análise, Inteligência policial, diretrizes.;Apresentação de Proposição;2025-12-09;Aguardando Chancela e Publicação do Despacho;0.7881;SIM;0.6972
PL 2338/2023;Projeto de Lei;2025-03-17;Senado Federal - Rodrigo Pacheco;N/A;Dispõe sobre o desenvolvimento, o fomento e o uso ético e responsável da inteligência artificial com base na centralidade da pessoa humana.;https://www.camara.leg.br/proposicoesWeb/prop_mostrarintegra?codteor=2868197;https://www.camara.leg.br/proposicoesWeb/fichadetramitacao?idProposicao=2487262;Diretrizes, desenvolvimento, incentivo, utilização, ética, inteligência artificial, direitos, pessoa, autorregulação, penalidade, competência, autoridade, Poder Público, critério, proteção, trabalho, trabalhador. _Alteração, Política Nacional de Educação Digital (PNED), inclusão, educação digital, instituição de ensino, letramento algorítmico, letramento crítico, inteligência artificial. _Alteração, lei federal, aplicação, recursos públicos, Fundo Nacional de Desenvolvimento Científico e Tecnológico (FNDCT), pesquisa, projeto (administração), inteligência artificial.;Aprovação de Requerimento;2026-02-11;Aguardando Parecer;0.7849;SIM;0.6928
PL 83/2026;Projeto de Lei;2026-02-02;Pastor Henrique Vieira;PSOL;Dispõe sobre a identificação obrigatória de conteúdos gerados ou manipulados por inteligência artificial, estabelece responsabilidade objetiva das plataformas digitais e tipifica condutas relacionadas à difusão de deepfakes.;https://www.camara.leg.br/proposicoesWeb/prop_mostrarintegra?codteor=3076637;https://www.camara.leg.br/proposicoesWeb/fichadetramitacao?idProposicao=2600154;Obrigatoriedade, Plataforma digital, usuário, rede social digital, identificação, conteúdo digital, inteligência artificial, proibição, publicação, Deepfake.;Apresentação de Proposição;2026-02-02;;0.7848;SIM;0.6926
PL 2129/2025;Projeto de Lei;2025-05-06;Nitinho;PSD;Dispõe sobre a obrigatoriedade de inclusão de conteúdos relacionados à inteligência artificial no currículo da educação básica.;https://www.camara.leg.br/proposicoesWeb/prop_mostrarintegra?codteor=2899204;https://www.camara.leg.br/proposicoesWeb/fichadetramitacao?idProposicao=2504671;Obrigatoriedade, inclusão, Currículo escolar, Disciplina (educação), Inteligência artificial, Educação básica.;Encerramento de Prazo;2025-07-02;Aguardando Parecer;0.7755;SIM;0.6793
PL 1893/2025;Projeto de Lei;2025-04-28;Rogéria Santos;REPUBLICANOS;Institui o Programa Nacional de Prevenção e Combate ao Estelionato Digital com o uso de algoritmos e inteligência artificial, e dá outras providências.;https://www.camara.leg.br/proposicoesWeb/prop_mostrarintegra?codteor=2892590;https://www.camara.leg.br/proposicoesWeb/fichadetramitacao?idProposicao=2500774;Criação, Programa Nacional de Prevenção e Combate ao Estelionato Digital (PROALGODIGITAL), regulação, utilização, Big data, Algoritmo, inteligência artificial, prevenção, Crime cibernético, fraude eletrônica.;Designação de Relator(a);2026-02-11;Aguardando Parecer;0.7749;SIM;0.6785
PL 1153/2023;Projeto de Lei;2023-03-15;Carlos Henrique Gaguim;UNIÃO;Dispõe sobre normas gerais para a pesquisa, o desenvolvimento e a aplicação da inteligência artificial - IA, e seu uso consciente e ético no âmbito da União, dos Estados, do Distrito Federal e dos Municípios.;https://www.camara.leg.br/proposicoesWeb/prop_mostrarintegra?codteor=2243580;https://www.camara.leg.br/proposicoesWeb/fichadetramitacao?idProposicao=2351386;Norma geral, pesquisa e desenvolvimento, aplicação, Inteligência artificial, utilização, Inteligência artificial, âmbito, União, estado (ente federado), Distrito Federal (Brasil). _Criação, Centro Nacional de Inteligência Artificial, vinculação, Ministério da Ciência, Tecnologia e Inovação, finalidade, desenvolvimento, coordenação, política pública, programa (administração), projeto (administração), incentivo, pesquisa e desenvolvimento, inteligência artificial. _Utilização, inteligência artificial, administração pública, princípios, critério técnico, dados científicos. _Estado (ente federado), Distrito Federal, município, criação, legislação suplementar, realização, convênio, parceria público-privada.;Publicação de Proposição;2023-04-24;Tramitando em Conjunto;0.7738;SIM;0.6769
PL 897/2024;Projeto de Lei;2024-03-20;Saullo Vianna;UNIÃO;Dispõe sobre a Autenticação de Mídia Digital criada ou modificada por Inteligência Artificial (IA) e dá outras providências.;https://www.camara.leg.br/proposicoesWeb/prop_mostrarintegra?codteor=2397672;https://www.camara.leg.br/proposicoesWeb/fichadetramitacao?idProposicao=2422387;Obrigatoriedade, autenticação, Mídia digital, utilização, Inteligência Artificial, diretrizes.;Recebimento;2024-03-27;Tramitando em Conjunto;0.7724;SIM;0.6748
PL 6712/2025;Projeto de Lei;2025-12-22;Amom Mandel;CIDADANIA;Estabelece a obrigatoriedade de identificação prévia de chamadas telefônicas automatizadas e de ligações realizadas por sistemas de inteligência artificial, e dá outras providências.;https://www.camara.leg.br/proposicoesWeb/prop_mostrarintegra?codteor=3072077;https://www.camara.leg.br/proposicoesWeb/fichadetramitacao?idProposicao=2599305;Obrigatoriedade, identificação, Ligação telefônica, Identificador de chamadas, Robocall, Telemarketing, Inteligência artificial.;Apresentação de Proposição;2025-12-22;Aguardando Chancela e Publicação do Despacho;0.7678;SIM;0.6683
PL 6663/2025;Projeto de Lei;2025-12-22;Amom Mandel;CIDADANIA;Cria o Selo Empresa Transparente em Inteligência Artificial, certificando organizações que adotem práticas claras, éticas e auditáveis no uso de algoritmos.;https://www.camara.leg.br/proposicoesWeb/prop_mostrarintegra?codteor=3071689;https://www.camara.leg.br/proposicoesWeb/fichadetramitacao?idProposicao=2599040;Criação, incentivo, Governança, Ética digital, Ética profissional, Selo de certificação, Empresa, utilização, Inteligência artificial, Algoritmo, Transparência algorítmica, Decisão automatizada, Tecnologia, diretrizes.;Recebimento;2026-02-13;Aguardando Designação de Relator(a);0.7615;SIM;0.6593
PL 705/2022;Projeto de Lei;2022-03-24;Helio Lopes;PL;Dispõe sobre a compatibilização dos sistemas de Inteligência Artificial utilizados pela Administração Pública a práticas da agenda ambiental, social e de governança.;https://www.camara.leg.br/proposicoesWeb/prop_mostrarintegra?codteor=2152436;https://www.camara.leg.br/proposicoesWeb/fichadetramitacao?idProposicao=2318674;Compatibilização, sistema computacional, inteligência artificial, Administração direta, Administração indireta, boas práticas, meio ambiente, ambiente social, governança. _Finalidade, promoção, desenvolvimento econômico,  desenvolvimento sustentável, respeito, pluralidade, diversidade, garantia, utilização, meios, governança, fundamentação, transparência, ética, colaboração.;Arquivamento;2024-12-10;Arquivada;0.7598;SIM;0.6569
PL 1325/2025;Projeto de Lei;2025-03-31;Silvia Waiãpi;PL;Dispõe sobre a inserção do estudo de Inteligência Artificial na grade curricular do ensino fundamental e dá outras providências.;https://www.camara.leg.br/proposicoesWeb/prop_mostrarintegra?codteor=2875405;https://www.camara.leg.br/proposicoesWeb/fichadetramitacao?idProposicao=2491093;Obrigatoriedade, inclusão, ensino, conteúdo educativo, Inteligência artificial, grade curricular, instituição de ensino, educação básica, diretrizes.;Encerramento de Prazo;2025-06-26;Aguardando Parecer;0.7588;SIM;0.6554
PL 4356/2025;Projeto de Lei;2025-09-02;Romero Rodrigues;PODE;Estabelece normas gerais programáticas, de aplicação em âmbito nacional, para a utilização de tecnologias baseadas em inteligência artificial no âmbito do Sistema Único de Segurança Pública – SUSP, visando à prevenção e à repressão de infrações penais, à proteção de pessoas e bens e à preservação da ordem pública, potencializando a observância dos direitos e garantias fundamentais.;https://www.camara.leg.br/proposicoesWeb/prop_mostrarintegra?codteor=2990573;https://www.camara.leg.br/proposicoesWeb/fichadetramitacao?idProposicao=2555654;Alteração, lei federal, Fundo Nacional de Segurança Pública (FNSP), transferência, recursos, condição, repasse, comprovação, cumprimento, integralidade, tecnologia, inteligência artificial, segurança pública, diretrizes, Sistema Único de Segurança Pública (Susp), solução tecnológica, regulamentação, limitação.;Saída de Relator(a) da Comissão - Sem Parecer Apresentado;2026-02-03;Aguardando Designação - Aguardando Devolução de Relator(a) que deixou de ser Membro;0.7577;SIM;0.6539
PL 6706/2025;Projeto de Lei;2025-12-22;Amom Mandel;CIDADANIA;Altera a Lei nº 13.709, de 14 de agosto de 2018 (Lei Geral de Proteção de Dados Pessoais - LGPD), para dispor sobre a Auditoria Algorítmica Preventiva em sistemas de Inteligência Artificial que afetam decisões de alto impacto social.;https://www.camara.leg.br/proposicoesWeb/prop_mostrarintegra?codteor=3071971;https://www.camara.leg.br/proposicoesWeb/fichadetramitacao?idProposicao=2599299;Alteração, Lei Geral de Proteção de Dados Pessoais (LGPDP) (2018), auditoria externa, algoritmo, inteligência artificial, relatório técnico, Agência Nacional de Proteção de Dados (ANPD), diretrizes.;Publicação de Proposição;2026-02-13;;0.7577;SIM;0.6538
PL 4849/2024;Projeto de Lei;2024-12-11;Eduardo Bismarck;PDT;Estabelece fundamentos, princípios e diretrizes e a aplicação da Inteligência Artificial no Brasil.;https://www.camara.leg.br/proposicoesWeb/prop_mostrarintegra?codteor=2840632;https://www.camara.leg.br/proposicoesWeb/fichadetramitacao?idProposicao=2479396;Regulamentação, sistema de inteligência artificial, diretrizes, poder público.;Notificações;2025-07-08;Tramitando em Conjunto;0.7562;SIM;0.6517
PL 1797/2024;Projeto de Lei;2024-05-14;Dr. Allan Garcês;PP;Estabelece normas gerais para o desenvolvimento, implementação e uso responsável de sistemas de Inteligência Artificial, com o objetivo de proteger os direitos humanos e a garantia de sistemas seguros e confiáveis em benefício da pessoa humana.;https://www.camara.leg.br/proposicoesWeb/prop_mostrarintegra?codteor=2422876;https://www.camara.leg.br/proposicoesWeb/fichadetramitacao?idProposicao=2433206;Diretrizes, uso seguro, Inteligência artificial, sistema de informação, confiabilidade, proteção, direitos humanos. _Alteração, Lei Geral de Proteção de Dados Pessoais (LGPDP) (2018), competência, Autoridade Nacional de Proteção de Dados (ANPD). _Criação, Conselho Nacional sobre Inteligência Artificial.;Notificações;2025-07-08;Tramitando em Conjunto;0.7525;SIM;0.6464
PL 4455/2025;Projeto de Lei;2025-09-04;Maurício Carvalho;UNIÃO;Altera a Lei nº 14.533, de 11 de janeiro de 2023, que institui a Política Nacional de Educação Digital e dá outras providências, para dispor sobre desenvolvimento de competências para o uso inteligência artificial.;https://www.camara.leg.br/proposicoesWeb/prop_mostrarintegra?codteor=2993539;https://www.camara.leg.br/proposicoesWeb/fichadetramitacao?idProposicao=2557405;Alteração, Política Nacional de Educação Digital (PNED), inclusão, prioridade, estratégia (administração), educação digital, desenvolvimento, competência, aluno, educação básica, responsabilidade, utilização, inteligência artificial generativa.;Recebimento;2025-10-06;Tramitando em Conjunto;0.7517;SIM;0.6453
PL 1614/2025;Projeto de Lei;2025-04-09;Zé Neto;PT;Altera a Lei nº 14.533, de 11 de janeiro de 2023, para dispor sobre a inclusão de aspectos relacionados à inteligência artificial, à segurança na rede e à proteção de dados pessoais na formação continuada dos profissionais da educação.;https://www.camara.leg.br/proposicoesWeb/prop_mostrarintegra?codteor=2883999;https://www.camara.leg.br/proposicoesWeb/fichadetramitacao?idProposicao=2496418;Alteração, Política Nacional de Educação Digital (PNED), inclusão, Conteúdo programático, Tecnologia digital, Educação continuada, Inteligência artificial, Segurança de dados, Profissional da educação.;Apresentação de Requerimento;2025-10-13;Aguardando Designação de Relator(a);0.7495;SIM;0.6422
PL 1290/2025;Projeto de Lei;2025-03-27;Hildo Rocha;MDB;Altera a Lei nº 9.784, de 29 de janeiro de 1999, para regulamentar o uso da inteligência artificial nos processos administrativos, no âmbito da Administração Pública Federal.;https://www.camara.leg.br/proposicoesWeb/prop_mostrarintegra?codteor=2874393;https://www.camara.leg.br/proposicoesWeb/fichadetramitacao?idProposicao=2490659;Alteração, Lei Geral do Processo Administrativo (1999), regulamentação, utilização, inteligência artificial, processo administrativo, âmbito, Administração federal, diretrizes.;Apresentação de Requerimento;2025-08-05;Aguardando Parecer;0.7485;SIM;0.6408
PL 2688/2025;Projeto de Lei;2025-06-02;João Daniel;PT;Institui o Marco Regulatório do Desenvolvimento e Uso da Inteligência Artificial no Brasil, estabelece direitos, deveres, princípios, mecanismos de governança, normas de transparência e responsabilidade civil e penal, e dá outras providências.;https://www.camara.leg.br/proposicoesWeb/prop_mostrarintegra?codteor=2924713;https://www.camara.leg.br/proposicoesWeb/fichadetramitacao?idProposicao=2520003;Criação, Marco regulatório, desenvovlimento, utilização, Inteligência artificial, diretrizes, Governança, transparência, Responsabilidade civil, Responsabilidade penal, proteção, Dados pessoais, Plataforma digital.;Parecer do(a) Relator(a);2026-02-11;Pronta para Pauta;0.7460;SIM;0.6372
PL 1969/2025;Projeto de Lei;2025-04-29;Adilson Barroso;PL;Dispõe sobre a inclusão na Lei nº 9.610, de 19 de fevereiro de 1998, da regulação da titularidade, autoria, registro, proteção e responsabilidade civil relativa às obras intelectuais geradas por sistemas de Inteligência Artificial (IA).;https://www.camara.leg.br/proposicoesWeb/prop_mostrarintegra?codteor=2895661;https://www.camara.leg.br/proposicoesWeb/fichadetramitacao?idProposicao=2502877;Alteração, Lei dos Direitos Autorais (1998), regulamentação, titularidade, autoria (publicação), registro, proteção, responsabilidade civil, obra intelectual, inteligência artificial, diretrizes.;Recebimento;2025-09-23;Tramitando em Conjunto;0.7449;SIM;0.6355
PL 303/2024;Projeto de Lei;2024-02-20;Júnior Mano;PSB;Altera o art. 6º da Lei nº 9.279, de 14 de maio de 1996, para dispor sobre a titularidade de invenções geradas de forma autônoma por sistemas de inteligência artificial.;https://www.camara.leg.br/proposicoesWeb/prop_mostrarintegra?codteor=2387544;https://www.camara.leg.br/proposicoesWeb/fichadetramitacao?idProposicao=2418048;Alteração, Lei de Propriedade Industrial, titularidade, invenção, geração, forma autônoma, Sistema de inteligência artificial.;Designação de Relator(a);2025-06-11;Aguardando Parecer;0.7425;SIM;0.6321
PL 1685/2025;Projeto de Lei;2025-04-14;Carla Zambelli;PL;Dispõe sobre a inclusão na Lei nº 9.610, de 19 de fevereiro de 1998, da regulação da titularidade, autoria, registro, proteção e responsabilidade civil relativas às obras intelectuais geradas por sistemas de Inteligência Artificial (IA).;https://www.camara.leg.br/proposicoesWeb/prop_mostrarintegra?codteor=2886523;https://www.camara.leg.br/proposicoesWeb/fichadetramitacao?idProposicao=2497660;Alteração, Lei dos Direitos Autorais (1998), disciplinamento, criação, registro, autoria, utilização, obra intelectual, Inteligência Artificial Generativa, responsabilidade civil, proteção, Direito autoral, pessoa física, diretrizes.;Recebimento;2025-09-23;Tramitando em Conjunto;0.7423;SIM;0.6319
PL 1465/2024;Projeto de Lei;2024-04-26;Júnior Mano;PSB;Estabelece princípios, garantias, direitos e deveres para o desenvolvimento, a implementação e a aplicação da inteligência artificial no Brasil, visando promover sua utilização segura, ética e responsável.;https://www.camara.leg.br/proposicoesWeb/prop_mostrarintegra?codteor=2414736;https://www.camara.leg.br/proposicoesWeb/fichadetramitacao?idProposicao=2430325;Inteligência artificial, princípios, desenvolvimento, aplicação, utilização. _Inteligência artificial, garantia, direitos individuais, usuário, ausência, discriminação, segurança de dados, privacidade. _ Sistema de inteligência artificial, transparência, ética, gestão de riscos. _Deveres, responsabilidade, agente, operador, fornecimento, sistema de inteligência artificial, infração, penalidade administrativa, pena de multa.;Apresentação de Requerimento;2025-08-05;Aguardando Parecer;0.7418;SIM;0.6311
PL 7135/2025;Projeto de Lei;2025-12-22;Amom Mandel;CIDADANIA;Altera a Lei nº 8.248, de 23 de outubro de 1991 (Lei de Informática), para estabelecer critérios de inclusão social e digital em Inteligência Artificial como contrapartida obrigatória para a fruição de incentivos fiscais.;https://www.camara.leg.br/proposicoesWeb/prop_mostrarintegra?codteor=3072675;https://www.camara.leg.br/proposicoesWeb/fichadetramitacao?idProposicao=2599744;Alteração, Lei de Informática (1991), concessão, incentivo fiscal, benefício fiscal, empresa, obrigatoriedade, investimento, percentual, limite mínimo, pesquisa, capacitação, disponibilização, inteligência artificial generativa, comunidade, população de baixa renda, instituição de ensino pública, área rural, local ermo, democratização, inclusão digital.;Apresentação de Proposição;2025-12-22;Aguardando Chancela e Publicação do Despacho;0.7409;SIM;0.6298
PL 1635/2024;Projeto de Lei;2024-05-07;Vinicius Carvalho;REPUBLICANOS;Dispõe sobre a proteção do consumidor contra práticas de colusão artificial implementadas por meio de algoritmos de precificação.;https://www.camara.leg.br/proposicoesWeb/prop_mostrarintegra?codteor=2418447;https://www.camara.leg.br/proposicoesWeb/fichadetramitacao?idProposicao=2431834;Alteração, Código de Defesa do Consumidor (1990), proteção, defesa do consumidor, vedação, conluio, algoritmo, inteligência artificial, inteligência artificial, precificação dinâmica, prejuízo, livre concorrência.;Apensação;2024-06-19;Tramitando em Conjunto;0.7397;SIM;0.6281
PL 898/2025;Projeto de Lei;2025-03-11;Helio Lopes;PL;Institui a Lei de Incentivo à Pesquisa e Desenvolvimento da Inteligência Artificial no Brasil e dá outras providências.;https://www.camara.leg.br/proposicoesWeb/prop_mostrarintegra?codteor=2865103;https://www.camara.leg.br/proposicoesWeb/fichadetramitacao?idProposicao=2486482;Criação, Ação governamental, destinação, Recursos financeiros, fomento, incentivo, Pesquisa científica, Pesquisa acadêmica, Inovação tecnológica, Desenvolvimento tecnológico, Inteligência artificial.;Encerramento de Prazo;2026-02-10;Aguardando Designação de Relator(a);0.7393;SIM;0.6276
