Norma;Descricao da Sigla;Data de Apresentacao;Autor;Partido;Ementa;Link Documento PDF;Link Página Web;Indexacao;Último Estado;Data Último Estado;Situação;Score Final;Boost Keyword;Similaridade Semantica
PL 4911/2023;Projeto de Lei;2023-10-09;Max Lemos;PDT;Regulamenta a Profissão de Alpinismo Industrial e dá outras providências;https://www.camara.leg.br/proposicoesWeb/prop_mostrarintegra?codteor=2342448;https://www.camara.leg.br/proposicoesWeb/fichadetramitacao?idProposicao=2394688;Regulamentação profissional, alpinismo industrial, atividade profissional, acesso, local, altura, execução, trabalho, inspeção, manutenção, instalação, reparo, superfície vertical. _Requisito, exercício profissional, empresa, serviços, alpinismo industrial. _Atividade, alpinismo industrial, ocorrência, setor industrial, exploração, petróleo, Indústria petroquímica.;Expedição de Documento;2025-02-14;Aguardando Apreciação pelo Senado Federal;0.5920;SIM;0.4172
PL 4768/2024;Projeto de Lei;2024-12-09;Juninho do Pneu;UNIÃO;Dispõe sobre a responsabilização do crime de manipulação de imagem de forma não autorizada.;https://www.camara.leg.br/proposicoesWeb/prop_mostrarintegra?codteor=2836557;https://www.camara.leg.br/proposicoesWeb/fichadetramitacao?idProposicao=2477182;Alteração, Código Penal (1940), Tipificação de conduta, Crime, Tratamento de imagem, Fotografia retocada, Inteligência artificial, utilização indevida, Deepfake.;Recebimento;2025-05-14;Tramitando em Conjunto;0.5909;SIM;0.4156
PL 5929/2023;Projeto de Lei;2023-12-07;Guilherme Boulos;PSOL;Dispõe sobre a regulamentação da atividade profissional de motorista por aplicativos, estabelecendo normas e critérios de transparência e fornecimento de dados por parte das Operadoras de Tecnologia para Transporte de Passageiros (OTTP), regras para a segurança e defesa do motorista em processos administrativos e criminais, e outras providências.;https://www.camara.leg.br/proposicoesWeb/prop_mostrarintegra?codteor=2373044;https://www.camara.leg.br/proposicoesWeb/fichadetramitacao?idProposicao=2411784;Regulamentação, Atividade profissional, Regulamentação profissional, Profissão regulamentada, Motorista de aplicativo, funcionamento, Aplicativo de transporte, Operadora de Transporte Privado Individual de Passageiros (OTPP), Admissão no emprego, Transporte de passageiro, Transporte por aplicativo.;Notificacao para Publicação Intermediária;2025-05-30;Tramitando em Conjunto;0.5903;SIM;0.4147
PL 2022/2019;Projeto de Lei;2019-04-03;Mauro Nazif;PSB;Regulamenta o exercício da profissão de Despachante Documentalista e dá outras providências.;https://www.camara.leg.br/proposicoesWeb/prop_mostrarintegra?codteor=1728102;https://www.camara.leg.br/proposicoesWeb/fichadetramitacao?idProposicao=2196739;Regulamentação profissional, Despachante Documentalista, diretrizes, profissão.;Recebimento;2022-02-14;Transformado em Norma Jurídica;0.5876;SIM;0.4109
PL 6211/2023;Projeto de Lei;2023-12-22;Renata Abreu;PODE;Altera a Lei no 8.069, de 13 de julho de 1990 – Estatuto da Criança e do Adolescente, para criminalizar a criação de conteúdo erótico e pornográfico, a partir do rosto de crianças e adolescentes, por meio de sistemas de inteligência artificial e altera o Decreto-Lei no 2.848, de 7 de dezembro de 1940 – Código Penal, para criminalizar a criação de conteúdo erótico e pornográfico por meio de sistemas de inteligência artificial, a partir do resto da vítima, e sem o seu consentimento.;https://www.camara.leg.br/proposicoesWeb/prop_mostrarintegra?codteor=2382124;https://www.camara.leg.br/proposicoesWeb/fichadetramitacao?idProposicao=2416533;Alteração, Estatuto da Criança e do Adolescente (ECA), Código Penal (1940), criminalização, criação, comercialização, imagem, vídeo, cena de sexo, nudez, pornografia, geração, Sistema de inteligência artificial, utilização, face, criança, adolescente.;Notificações;2024-03-12;Tramitando em Conjunto;0.5873;SIM;0.4104
PL 1030/2025;Projeto de Lei;2025-03-17;Alberto Fraga;PL;Institui a Medalha do Mérito da Inteligência Nacional, e dá outras providências.;https://www.camara.leg.br/proposicoesWeb/prop_mostrarintegra?codteor=2868103;https://www.camara.leg.br/proposicoesWeb/fichadetramitacao?idProposicao=2487245;Criação, Medalha do Mérito da Inteligência Nacional, condecoração, atividade de inteligência, inteligência de segurança pública, homenagem, cerimônia, dezembro, conselho consultivo, Sistema Brasileiro de Inteligência (SISBIN).;Recebimento;2025-04-25;Aguardando Designação de Relator(a);0.5837;SIM;0.4053
PL 4995/2025;Projeto de Lei;2025-10-07;Alfredinho;PT;Regulamenta o exercício das profissões de Promotor de Vendas e de Demonstrador de Mercadorias.;https://www.camara.leg.br/proposicoesWeb/prop_mostrarintegra?codteor=3014542;https://www.camara.leg.br/proposicoesWeb/fichadetramitacao?idProposicao=2567950;Regulamentação profissional, promotor de vendas, demonstrador de mercadorias, diretrizes.;Publicação de Proposição;2025-11-07;Tramitando em Conjunto;0.5792;SIM;0.3989
PL 3751/2025;Projeto de Lei;2025-08-06;Duda Ramos;MDB;Estabelece a prioridade na destinação de recursos para ações de informação e inteligência no combate aos crimes financeiros virtuais, com ênfase no estelionato digital, phishing, roubo de identidade, fraudes financeiras online e outros crimes cibernéticos, além de implementar a capacitação de profissionais, a utilização de tecnologias avançadas e a criação de um ambiente mais seguro no espaço digital.;https://www.camara.leg.br/proposicoesWeb/prop_mostrarintegra?codteor=2967452;https://www.camara.leg.br/proposicoesWeb/fichadetramitacao?idProposicao=2540796;Prioridade, União, destinação, recursos públicos, Atividade de inteligência, Educação e formação profissional, Segurança cibernética, combate, Crime cibernético, Estelionato virtual, Fraude eletrônica, diretrizes.;Saída de Relator(a) da Comissão - Sem Parecer Apresentado;2026-02-03;Aguardando Designação - Aguardando Devolução de Relator(a) que deixou de ser Membro;0.5786;SIM;0.3981
PL 4385/2020;Projeto de Lei;2020-08-27;Camilo Capiberibe;PSB;.Dispõe sobre a regulamentação da profissão de Antropólogo e dá outras providências.;https://www.camara.leg.br/proposicoesWeb/prop_mostrarintegra?codteor=1925977;https://www.camara.leg.br/proposicoesWeb/fichadetramitacao?idProposicao=2261161;Regulamentação profissional, Antropólogo, atribuição.;Publicação de Proposição;2021-03-24;Retirado pelo(a) Autor(a);0.5782;SIM;0.3975
PL 3604/2024;Projeto de Lei;2024-09-17;Fred Linhares;REPUBLICANOS;Altera a Lei nº 12.114, de 9 de dezembro de 2009, que Cria o Fundo Nacional sobre Mudança do Clima, para permitir o investimento de recursos no desenvolvimento de tecnologia da informação (TI) e da inteligência artificial (IA) na prevenção e contenção de incêndio em ambientes naturais, e dá outras providências.;https://www.camara.leg.br/proposicoesWeb/prop_mostrarintegra?codteor=2477699;https://www.camara.leg.br/proposicoesWeb/fichadetramitacao?idProposicao=2458566;Alteração, lei federal, utilização, recursos, Fundo Nacional sobre Mudança do Clima (FNMC), prevenção, contenção, incêndio, queimada, incêndio florestal, tecnologia da informação, inteligência artificial.;Encerramento de Prazo;2025-04-29;Aguardando Parecer;0.5782;SIM;0.3974
PL 2506/2024;Projeto de Lei;2024-06-20;Rogéria Santos;REPUBLICANOS;Altera o Decreto-Lei nº 2.848, de 7 de dezembro de 1940 – Código Penal, para estabelecer causa de aumento de pena no crime de favorecimento da prostituição ou de outra forma de exploração sexual de criança ou adolescente ou de vulnerável quando praticado com o uso de inteligência artificial.;https://www.camara.leg.br/proposicoesWeb/prop_mostrarintegra?codteor=2440567;https://www.camara.leg.br/proposicoesWeb/fichadetramitacao?idProposicao=2442452;Alteração, Código Penal (1940), Crime sexual contra vulnerável, aumento da pena, Favorecimento da prostituição ou outra forma de exploração sexual de criança ou adolescente ou vulnerável, utilização, tecnologia, inteligência artificial.;Designação de Relator(a);2025-12-18;Aguardando Parecer;0.5774;SIM;0.3962
PL 2192/2023;Projeto de Lei;2023-04-26;Juninho do Pneu;UNIÃO;Regulamenta a profissão de Consultor Político e dá outras providências.;https://www.camara.leg.br/proposicoesWeb/prop_mostrarintegra?codteor=2264627;https://www.camara.leg.br/proposicoesWeb/fichadetramitacao?idProposicao=2358656;Regulamentação profissional, exercício profissional, consultor política, requisito, atribuição, atividade.;Publicação de Proposição;2025-08-27;Aguardando Designação de Relator(a);0.5742;SIM;0.3916
PL 3301/2024;Projeto de Lei;2024-08-26;Juninho do Pneu;UNIÃO;Regulamenta o exercício profissional da atividade de Ergonomista.;https://www.camara.leg.br/proposicoesWeb/prop_mostrarintegra?codteor=2469118;https://www.camara.leg.br/proposicoesWeb/fichadetramitacao?idProposicao=2454986;Regulamentação profissional, profissão, ergonomista, exercício profissional, ergonomia, diretrizes, ambiente de trabalho;Encerramento de Prazo;2025-05-27;Aguardando Parecer;0.5729;SIM;0.3899
PL 3022/2021;Projeto de Lei;2021-08-31;Alexandre Padilha;PT;Altera a Lei nº 6.533, de 24 de maio de 1978, que dispõe sobre a regulamentação das profissões de Artistas e de técnico em Espetáculos de Diversões, e dá outras providências, para prever políticas de memória e preservação do conhecimento adquiridos por essas profissionais entre outros.;https://www.camara.leg.br/proposicoesWeb/prop_mostrarintegra?codteor=2066375;https://www.camara.leg.br/proposicoesWeb/fichadetramitacao?idProposicao=2296902;Alteração, Lei Federal, Regulamentação profissional, Técnico em Espetáculos de Diversões, estímulo, projeto (administração), acervo documental, preservação, conhecimento, memória cultural, profissional, atividade cultural.;Saída de Relator(a) da Comissão - Com Parecer Apresentado;2025-03-19;Aguardando Designação de Relator(a);0.5692;SIM;0.3845
PL 4869/2023;Projeto de Lei;2023-10-05;Marco Brasil;PP;Veda a demissão ou redução da jornada de trabalho dos profissionais da voz e dos intérpretes de Língua Brasileira de Sinais - Libras em razão da utilização de ferramentas de inteligência artificial para produção de conteúdos audiovisuais.;https://www.camara.leg.br/proposicoesWeb/prop_mostrarintegra?codteor=2341398;https://www.camara.leg.br/proposicoesWeb/fichadetramitacao?idProposicao=2394357;Proibição, demissão, redução, jornada de trabalho, profissional, voz humana, Intérprete de língua de sinais, decorrência, utilização, ferramenta tecnológica, inteligência artificial, produção, conteúdo audiovisual.;Encerramento de Prazo;2024-05-07;Aguardando Designação - Aguardando Devolução de Relator(a) que deixou de ser Membro;0.5684;SIM;0.3835
PL 3997/2025;Projeto de Lei;2025-08-14;Zezinho Barbary;PP;Dispõe sobre a regulamentação da profissão de Microscopista e dá outras providências;https://www.camara.leg.br/proposicoesWeb/prop_mostrarintegra?codteor=2974992;https://www.camara.leg.br/proposicoesWeb/fichadetramitacao?idProposicao=2545774;Regulamentação profissional, microscopista, atividade profissional, requisito, diretrizes.;Recebimento;2025-09-16;Aguardando Designação de Relator(a);0.5666;SIM;0.3808
PL 2394/2023;Projeto de Lei;2023-05-08;Delegado Marcelo Freitas;UNIÃO;Criminaliza a produção, oferta, comercialização, divulgação, transmissão ou posse de imagens que representem crianças ou adolescentes em cenas de sexo explícito, implícito ou de cunho pornográfico, utilizando recursos de inteligência artificial ou meio semelhante. Acrescenta o artigo 241-F, à Lei 8.069 de 13 de julho de 1.990, (Estatuto da Criança e do Adolescente) e dá outras providências.;https://www.camara.leg.br/proposicoesWeb/prop_mostrarintegra?codteor=2269243;https://www.camara.leg.br/proposicoesWeb/fichadetramitacao?idProposicao=2360615;Alteração, Estatuto da Criança e do Adolescente (ECA) (1990), Crime contra a criança e o adolescente, oferta, divulgação, Cena pornográfica, Sexo explícito, criança, adolescente, utilização, inteligência artificial, aumento da pena, Tratamento de imagem, divulgação, rede social, internet.;Arquivamento;2023-12-06;Aguardando Encaminhamento;0.5663;SIM;0.3804
PL 2347/2022;Projeto de Lei;2022-08-25;José Nelto;UNIÃO;Dispõe sobre a regulamentação da atividade profissional de influenciador digital profissional no âmbito  Federal.;https://www.camara.leg.br/proposicoesWeb/prop_mostrarintegra?codteor=2204364;https://www.camara.leg.br/proposicoesWeb/fichadetramitacao?idProposicao=2334286;Regulamentação profissional, Influenciador Digital Profissional, criação, Conteúdo digital, Rede social, Mídia digital, competência, atribuição, Mercado de trabalho, Educação e formação profissional,;Notificacao para Publicação Intermediária;2025-10-14;Tramitando em Conjunto;0.5658;SIM;0.3797
PL 4272/2024;Projeto de Lei;2024-11-05;Rubens Pereira Júnior;PT;Altera o Estatuto da Criança e do Adolescente e a Lei de Crimes Hediondos para tipificar e tornar hedionda a produção, disseminação e posse de conteúdos gerados por inteligência artificial ou deepfakes que simulem pornografia infantil.;https://www.camara.leg.br/proposicoesWeb/prop_mostrarintegra?codteor=2816628;https://www.camara.leg.br/proposicoesWeb/fichadetramitacao?idProposicao=2467209;Alteração, Estatuto da Criança e do Adolescente (ECA) (1990), Lei dos Crimes Hediondos (1990), Tipificação de conduta, produção, propagação, Deepfake, Conteúdo impróprio, Inteligência artificial, simulação, Pornografia infantil, Abuso sexual, Criança.;Recebimento;2025-03-19;Tramitando em Conjunto;0.5654;SIM;0.3792
PL 3429/2020;Projeto de Lei;2020-06-19;Coronel Tadeu;PL;Regulamenta a profissão de Cientista de Alimentos.;https://www.camara.leg.br/proposicoesWeb/prop_mostrarintegra?codteor=1905953;https://www.camara.leg.br/proposicoesWeb/fichadetramitacao?idProposicao=2255757;Regulamentação profissional, cientista de alimentos, requisito, competência.;Encerramento de Prazo;2025-11-26;Aguardando Parecer;0.5649;SIM;0.3784
PL 974/2025;Projeto de Lei;2025-03-12;Duarte Jr.;PSB;Regula o exercício da profissão de Maqueiro, e dá outras providências.;https://www.camara.leg.br/proposicoesWeb/prop_mostrarintegra?codteor=2866036;https://www.camara.leg.br/proposicoesWeb/fichadetramitacao?idProposicao=2486804;Regulamentação profissional, Atividade profissional, Profissional de saúde, Maqueiro, Transporte, Paciente.;Apresentação de Requerimento;2025-12-17;Pronta para Pauta;0.5641;SIM;0.3773
PL 3581/2019;Projeto de Lei;2019-06-17;Eduardo Bismarck;PDT;Regulamenta o exercício da profissão de Coach e dá outras providências.;https://www.camara.leg.br/proposicoesWeb/prop_mostrarintegra?codteor=1765769;https://www.camara.leg.br/proposicoesWeb/fichadetramitacao?idProposicao=2208398;Regulamentação profissional, Coach, requisito, competência.;Notificações;2024-04-16;Tramitando em Conjunto;0.5630;SIM;0.3758
PL 3970/2019;Projeto de Lei;2019-07-09;Coronel Tadeu;PL;Regulamenta o exercício da profissão de Coach e dá outras providências.;https://www.camara.leg.br/proposicoesWeb/prop_mostrarintegra?codteor=1776628;https://www.camara.leg.br/proposicoesWeb/fichadetramitacao?idProposicao=2211545;Regulamentação profissional, Coach, requisito, competência, infração, Penalidade disciplinar, criação, Conselho Federal de Coach, Conselho Regional de Coach.;Notificações;2024-04-16;Tramitando em Conjunto;0.5630;SIM;0.3758
PL 3931/2023;Projeto de Lei;2023-08-15;Vicentinho;PT;Dispõe sobre a regulamentação da profissão de Disc Jockey (DJ) Profissional.;https://www.camara.leg.br/proposicoesWeb/prop_mostrarintegra?codteor=2312987;https://www.camara.leg.br/proposicoesWeb/fichadetramitacao?idProposicao=2379685;Criação, Regulamentação profissional, Atividade profissional, Exercício profissional, Profissão regulamentada, DJ (disc jockey).;Notificacao para Publicação Intermediária;2025-12-08;Tramitando em Conjunto;0.5624;SIM;0.3749
PL 5359/2023;Projeto de Lei;2023-11-06;Erika Kokay;PT;Altera a Lei nº 8.069, de 13 de julho de 1990 - Estatuto da Criança e do Adolescente, para criminalizar a adulteração, montagem ou modificação de fotografia, vídeo ou qualquer outra forma de representação visual por meio de Inteligência Artificial, a aquisição e a posse de tal material e outras condutas relacionadas à pedofilia na internet.;https://www.camara.leg.br/proposicoesWeb/prop_mostrarintegra?codteor=2355132;https://www.camara.leg.br/proposicoesWeb/fichadetramitacao?idProposicao=2401304;Alteração, Estatuto da Criança e do Adolescente (ECA) (1990), criminalização, adulteração, montagem, Fotografia, Fotografia retocada, Vídeo, Produto audiovisual, utilização, Inteligência artificial, Ciberpedofilia, Pedofilia, Rede social digital, Crime cibernético.;Arquivamento;2023-12-06;Aguardando Encaminhamento;0.5619;SIM;0.3742
PL 550/2025;Projeto de Lei;2025-02-19;Joaquim Passarinho;PL;Regulamenta a profissão de Síndico Administrador Profissional e dá outras providências.;https://www.camara.leg.br/proposicoesWeb/prop_mostrarintegra?codteor=2857384;https://www.camara.leg.br/proposicoesWeb/fichadetramitacao?idProposicao=2484488;Regulamentação profissional, síndico administrador, gestão, condomínio, Administração (ciência), registro, Conselho Regional de Administração (CRA), diretrizes.;Notificacao para Publicação Intermediária;2025-10-15;Tramitando em Conjunto;0.5609;SIM;0.3727
PL 6325/2025;Projeto de Lei;2025-12-10;Marcos Tavares;PDT;Institui a Lei Xena, que dispõe sobre a regulamentação da profissão de Passeador de Animais Domésticos, estabelece requisitos mínimos de formação técnica, cria cadastro público obrigatório, fixa limites operacionais, institui deveres, responsabilidades e penalidades, assegura a proteção da integridade física e psicológica dos animais e dá outras providências.;https://www.camara.leg.br/proposicoesWeb/prop_mostrarintegra?codteor=3065495;https://www.camara.leg.br/proposicoesWeb/fichadetramitacao?idProposicao=2595635;Criação, Lei Xena, regulamentação profissional, passeador de animais domésticos, critério, cadastro, profissional, formação, auxiliar de médico veterinário, deveres, responsabilidade, penalidade, diretrizes.;Recebimento;2026-02-20;Aguardando Designação de Relator(a);0.5582;SIM;0.3689
PL 1712/2025;Projeto de Lei;2025-04-15;Dr. Fernando Máximo;UNIÃO;"""Dispõe sobre a regulamentação do exercício profissional de eletricistas e estabelece medidas de proteção e segurança no trabalho, incluindo adicional de periculosidade e sanções por descumprimento de normas.""";https://www.camara.leg.br/proposicoesWeb/prop_mostrarintegra?codteor=2887427;https://www.camara.leg.br/proposicoesWeb/fichadetramitacao?idProposicao=2498005;Regulamentação profissional, eletricista, ajudante, eletrotécnico, diretrizes, adicional de periculosidade, equipamento de proteção individual, seguro de vida, empresa, condições de trabalho, segurança do trabalho.;Recebimento;2025-06-06;Aguardando Designação de Relator(a);0.5574;SIM;0.3677
PL 216/2026;Projeto de Lei;2026-02-03;Coronel Assis;UNIÃO;Dispõe sobre a criação do Sistema Nacional de Alerta por Comportamento Atípico Reincidente (SINACAR), estabelece princípios, objetivos, conceitos, limites jurídicos e salvaguardas para a identificação preventiva de padrões objetivos de risco à segurança pública, mediante integração qualificada de bases de dados estatais, e dá outras providências.;https://www.camara.leg.br/proposicoesWeb/prop_mostrarintegra?codteor=3078138;https://www.camara.leg.br/proposicoesWeb/fichadetramitacao?idProposicao=2600627;Criação, ação governamental, sistema de informação, monitoramento, identificação, aviso de alerta, prevenção, riscos (segurança), violência, integração, dados, Sistema Único de Segurança Pública (Susp), inteligência de segurança pública, diretrizes.;Apresentação de Proposição;2026-02-03;;0.5570;SIM;0.3672
PL 5132/2023;Projeto de Lei;2023-10-24;Amom Mandel;CIDADANIA;"Fixa limites à execução indireta, mediante contratação, de serviços da administração pública federal direta, autárquica e fundacional e das empresas públicas e das sociedades de economia mista controladas pela União; estabelece regra para nomeação de candidatos aprovados em concursos públicos realizados por esses órgãos e entidades.";https://www.camara.leg.br/proposicoesWeb/prop_mostrarintegra?codteor=2349207;https://www.camara.leg.br/proposicoesWeb/fichadetramitacao?idProposicao=2398673;Fixação, limite, Execução indireta, contratação, Serviço terceirizado, Administração Pública, Administração direta, Fundação pública, Autarquia, Empresa pública, Sociedade de economia mista, União, Estado (Ente federado), Distrito Federal (Brasil), Município. _ Regulamentação, Nomeação, candidato, concurso público.;Recebimento;2023-11-16;Tramitando em Conjunto;0.5568;SIM;0.3668
PL 1797/2021;Projeto de Lei;2021-05-12;Carla Dickson;UNIÃO;Dispõe sobre a regulamentação da profissão de Cuidador e dá outras providências.;https://www.camara.leg.br/proposicoesWeb/prop_mostrarintegra?codteor=2010248;https://www.camara.leg.br/proposicoesWeb/fichadetramitacao?idProposicao=2282706;Regulamentação profissional, Cuidador formal, requisito, direitos, deveres, contrato de trabalho.;Publicação de Proposição;2021-06-10;Tramitando em Conjunto;0.5567;SIM;0.3667
PL 2616/2019;Projeto de Lei;2019-05-07;Paulo Ramos;PDT;Regulamenta o exercício da profissão de Guarda-parque.;https://www.camara.leg.br/proposicoesWeb/prop_mostrarintegra?codteor=1741643;https://www.camara.leg.br/proposicoesWeb/fichadetramitacao?idProposicao=2200109;Regulamentação profissional, profissão,   Agente de Defesa Ambiental, requisito, competência.;Distribuição;2023-03-28;Aguardando Designação de Relator(a);0.5566;SIM;0.3666
PL 733/2024;Projeto de Lei;2024-03-13;Beto Pereira;PSDB;Institui varas especializadas para processar e julgar crimes cibernéticos.;https://www.camara.leg.br/proposicoesWeb/prop_mostrarintegra?codteor=2394356;https://www.camara.leg.br/proposicoesWeb/fichadetramitacao?idProposicao=2420743;Criação, Vara especializada, Tribunal de Justiça, Poder Judiciário, Processo penal, julgamento, Crime cibernético, manipulação, Inteligência artificial.;Publicação de Proposição;2024-04-19;Aguardando Encaminhamento;0.5562;SIM;0.3660
PL 5139/2023;Projeto de Lei;2023-10-24;Carlos Zarattini;PT;Acrescenta § 3º ao artigo 6º da LEI nº 9.883, DE 7 DE DEZEMBRO DE 1999, que  Institui o Sistema Brasileiro de Inteligência, cria a Agência Brasileira de Inteligência-ABIN, e dá outras providências.;https://www.camara.leg.br/proposicoesWeb/prop_mostrarintegra?codteor=2349245;https://www.camara.leg.br/proposicoesWeb/fichadetramitacao?idProposicao=2398699;Alteração, Lei da Agência Brasileira de Inteligência (1999), obrigatoriedade, Agência Brasileira de Inteligência (ABIN), relatório, Órgão de Controle Externo da Atividade de Inteligência, detalhamento, informação, atividade, operação, utilização, produtos, bens, serviços.;Notificações;2024-07-19;Tramitando em Conjunto;0.5561;SIM;0.3659
PL 6323/2025;Projeto de Lei;2025-12-10;Alice Portugal;PCdoB;Reconhece e regulamenta a profissão de Instrutor de Fanfarras e Bandas Marciais, estabelece suas atribuições, requisitos para exercício profissional e dá outras providências.;https://www.camara.leg.br/proposicoesWeb/prop_mostrarintegra?codteor=3065308;https://www.camara.leg.br/proposicoesWeb/fichadetramitacao?idProposicao=2595554;Regulamentação profissional, Instrutor de Fanfarras, Bandas Marciais e Liras Cecilianas, reconhecimento, prática, atividade cultural, atividade educativa, atividade artística, diretrizes.;Recebimento;2026-02-20;Aguardando Designação de Relator(a);0.5548;SIM;0.3640
PL 5119/2023;Projeto de Lei;2023-10-24;Amom Mandel;CIDADANIA;"Fixa limites à execução indireta, mediante contratação, de serviços da administração pública direta, autárquica e fundacional e das empresas públicas e das sociedades de economia mista controladas pela União, Estados, Distrito Federal e Municípios; estabelece regras para nomeação de candidatos aprovados em concursos públicos realizados por esses órgãos e entidades.";https://www.camara.leg.br/proposicoesWeb/prop_mostrarintegra?codteor=2348960;https://www.camara.leg.br/proposicoesWeb/fichadetramitacao?idProposicao=2398493;Fixação, limite, Execução indireta, contratação, Serviço terceirizado, Administração Pública, Administração direta, Fundação pública, Autarquia, Empresa pública, Sociedade de economia mista, União, Estado (Ente federado), Distrito Federal (Brasil), Município. _ Regulamentação, Nomeação, candidato, concurso público.;Recebimento;2023-11-16;Aguardando Designação de Relator(a);0.5547;SIM;0.3639
PL 437/2025;Projeto de Lei;2025-02-12;Zé Silva;SOLIDARIEDADE;Dispõe sobre a regulamentação do exercício da profissão de queijista.;https://www.camara.leg.br/proposicoesWeb/prop_mostrarintegra?codteor=2855172;https://www.camara.leg.br/proposicoesWeb/fichadetramitacao?idProposicao=2483920;Regulamentação profissional, Queijista, diretrizes.;Recebimento;2025-03-18;Aguardando Designação de Relator(a);0.5544;SIM;0.3634
